,number,value,datetime_start,datetime_complete,duration,params_T_max,params_batch_size,params_beta1,params_beta2,params_epochs,params_eta_min,params_factor,params_gamma,params_lr,params_max_lr,params_momentum,params_optimizer,params_patience,params_preweight_mode,params_scheduler,params_step_size,params_weight_decay,state
89,89,0.5926092863082886,2025-01-28 17:48:06.003466,2025-01-28 17:50:15.929092,0 days 00:02:09.925626,13.0,6,0.937686577316773,0.9297288381328532,15,4.339060897132052e-07,,,0.00035196016885849117,,,Adam,,fine_tuning,CosineAnnealingLR,,,PRUNED
90,90,0.600851833820343,2025-01-28 17:50:15.946815,2025-01-28 17:52:27.936621,0 days 00:02:11.989806,14.0,4,0.8840139150920878,0.92174226686755,18,3.910905312401507e-06,,,0.0004480569581348944,,,Adam,,fine_tuning,CosineAnnealingLR,,,PRUNED
91,91,0.6845894455909729,2025-01-28 17:52:27.954804,2025-01-28 17:59:01.735222,0 days 00:06:33.780418,10.0,4,0.8756500900230443,0.954646047236185,18,1.5931778726355424e-06,,,0.00011601741540773544,,,Adam,,fine_tuning,CosineAnnealingLR,,,COMPLETE
92,92,0.6376823782920837,2025-01-28 17:59:01.761415,2025-01-28 18:01:13.441297,0 days 00:02:11.679882,11.0,4,0.865375486353028,0.9641231020388307,18,1.492891158755432e-06,,,0.000143629613000593,,,Adam,,fine_tuning,CosineAnnealingLR,,,PRUNED
93,93,0.6550649404525757,2025-01-28 18:01:13.458712,2025-01-28 18:03:23.663683,0 days 00:02:10.204971,11.0,4,0.8853427574772779,0.9425418697239352,19,1.8844214311074074e-06,,,0.00016084263837527185,,,Adam,,fine_tuning,CosineAnnealingLR,,,PRUNED
94,94,0.6062515377998352,2025-01-28 18:03:23.681531,2025-01-28 18:05:36.440605,0 days 00:02:12.759074,12.0,4,0.8972497942833924,0.9770106704951702,17,9.09743644171488e-07,,,0.00010991580703962186,,,Adam,,fine_tuning,CosineAnnealingLR,,,PRUNED
95,95,0.14810095727443695,2025-01-28 18:05:36.458265,2025-01-28 18:08:07.638572,0 days 00:02:31.180307,9.0,4,0.8699801096831896,0.9483506544064693,19,2.2172465250700744e-06,,,0.00012826300424855468,,,AdamW,,random,CosineAnnealingLR,,0.005876199786252023,PRUNED
96,96,0.7061458826065063,2025-01-28 18:08:07.656180,2025-01-28 18:13:59.161135,0 days 00:05:51.504955,10.0,4,0.8782464611956078,0.9590688152568566,16,2.8154145877424695e-06,,,0.00021222813772422172,,,Adam,,fine_tuning,CosineAnnealingLR,,,COMPLETE
97,97,0.6912229657173157,2025-01-28 18:13:59.187080,2025-01-28 18:19:46.927437,0 days 00:05:47.740357,10.0,5,0.8795898760695122,0.9367034511672865,16,2.9089742560415874e-06,,,0.00020587330681229673,,,Adam,,fine_tuning,CosineAnnealingLR,,,COMPLETE
98,98,0.16369996964931488,2025-01-28 18:19:46.953399,2025-01-28 18:21:05.136330,0 days 00:01:18.182931,,4,0.8508181954368207,0.9670981788212385,16,,0.38527120951460536,,0.00026534855056032026,,,Adam,2.0,freezing,ReduceLROnPlateau,,,PRUNED
99,99,0.0,2025-01-28 18:21:05.152893,2025-01-28 18:22:55.247072,0 days 00:01:50.094179,8.0,4,,,14,7.129277579894768e-07,,,0.0010208010786078618,,0.9090232716446488,RMSprop,,fine_tuning,CosineAnnealingLR,,0.2132351510810794,PRUNED
