,number,value,datetime_start,datetime_complete,duration,params_T_max,params_batch_size,params_beta1,params_beta2,params_epochs,params_eta_min,params_factor,params_gamma,params_lr,params_max_lr,params_momentum,params_optimizer,params_patience,params_preweight_mode,params_scheduler,params_step_size,params_weight_decay,state
90,90,0.36809101700782776,2025-01-26 22:20:21.708316,2025-01-26 22:20:57.095092,0 days 00:00:35.386776,,4,0.8687229401245519,0.9595759085634047,16,,0.3701256243298344,,0.000186764752530795,,,Adam,4.0,fine_tuning,ReduceLROnPlateau,,,PRUNED
91,91,0.48387229442596436,2025-01-26 22:20:57.119291,2025-01-26 22:21:55.394745,0 days 00:00:58.275454,,7,0.9394598077516645,0.9464125001986076,12,,,0.2233954321903867,0.0007581186721903362,,,Adam,,fine_tuning,StepLR,4.0,,COMPLETE
92,92,0.3599684536457062,2025-01-26 22:21:55.412698,2025-01-26 22:22:25.454772,0 days 00:00:30.042074,,7,0.902786223732492,0.95449236960368,17,,0.1652969652262173,,0.00408963744394026,,,Adam,3.0,fine_tuning,ReduceLROnPlateau,,,PRUNED
93,93,0.3715953230857849,2025-01-26 22:22:25.472682,2025-01-26 22:22:56.232544,0 days 00:00:30.759862,10.0,6,0.9244356624652631,0.9505266416872927,18,6.059600179247309e-06,,,0.00012431601519100142,,,Adam,,fine_tuning,CosineAnnealingLR,,,PRUNED
94,94,0.430047869682312,2025-01-26 22:22:56.250598,2025-01-26 22:23:25.235644,0 days 00:00:28.985046,,7,0.8854550985741636,0.9277897751492133,17,,,,0.003542802148839862,0.00643301121583766,,Adam,,fine_tuning,OneCycleLR,,,PRUNED
95,95,0.2524321675300598,2025-01-26 22:23:25.250375,2025-01-26 22:23:57.444372,0 days 00:00:32.193997,,5,0.9763699935565331,0.9157557792132968,15,,,,0.0005884447857592409,0.00033746439191554325,,AdamW,,fine_tuning,OneCycleLR,,0.006211324460747782,PRUNED
96,96,0.40819719433784485,2025-01-26 22:23:57.459141,2025-01-26 22:24:24.948443,0 days 00:00:27.489302,,8,0.8939385403612579,0.9661185134109441,18,,,,0.0027283489993049086,0.004828106350258301,,Adam,,fine_tuning,OneCycleLR,,,PRUNED
97,97,0.11881188303232193,2025-01-26 22:24:24.965848,2025-01-26 22:24:49.942614,0 days 00:00:24.976766,,7,,,16,,,,0.005429474281266441,0.008228443133143611,0.9388568642866939,SGD,,freezing,OneCycleLR,,1.683756396226218e-05,PRUNED
98,98,0.0,2025-01-26 22:24:49.959301,2025-01-26 22:25:14.669440,0 days 00:00:24.710139,11.0,6,,,17,4.161965108068812e-07,,,0.0011167566505195703,,0.9680322550259355,RMSprop,,fine_tuning,CosineAnnealingLR,,0.2599443068729498,PRUNED
99,99,0.429590106010437,2025-01-26 22:25:14.684402,2025-01-26 22:25:49.039923,0 days 00:00:34.355521,,4,0.8579450908195179,0.9721163105885192,19,,,,0.0019385432068684386,0.005792101067224168,,Adam,,fine_tuning,OneCycleLR,,,PRUNED
