,number,value,datetime_start,datetime_complete,duration,params_T_max,params_batch_size,params_beta1,params_beta2,params_epochs,params_eta_min,params_factor,params_gamma,params_lr,params_max_lr,params_momentum,params_optimizer,params_patience,params_preweight_mode,params_scheduler,params_step_size,params_weight_decay,state
0,0,0.5111747980117798,2025-01-26 21:03:47.641535,2025-01-26 21:05:07.847827,0 days 00:01:20.206292,8.0,7,0.9658118084445251,0.9318563294010559,17,8.307341815284441e-06,,,0.0009472961959721175,,,Adam,,fine_tuning,CosineAnnealingLR,,,COMPLETE
1,1,0.40797606110572815,2025-01-26 21:05:07.866900,2025-01-26 21:06:12.764570,0 days 00:01:04.897670,,6,0.9169765854389738,0.9282853454922604,13,,,0.16714116943161034,0.0004904539339172869,,,Adam,,random,StepLR,5.0,,COMPLETE
2,2,0.16233369708061218,2025-01-26 21:06:12.782305,2025-01-26 21:07:22.485783,0 days 00:01:09.703478,,8,,,17,,,0.17734318931932058,0.004241247429282568,,0.9492067843282642,RMSprop,,freezing,StepLR,5.0,0.1260926568334326,COMPLETE
3,3,0.2482331544160843,2025-01-26 21:07:22.503593,2025-01-26 21:08:15.465631,0 days 00:00:52.962038,,8,,,13,,,0.056083539958035666,0.04948808716982222,,0.9468789822431335,SGD,,freezing,StepLR,5.0,5.129973236412686e-05,COMPLETE
4,4,0.3703068494796753,2025-01-26 21:08:15.483301,2025-01-26 21:09:38.610234,0 days 00:01:23.126933,,6,,,17,,,,0.02344308086614435,0.004548729885792942,0.9727457317944981,SGD,,fine_tuning,OneCycleLR,,4.760099310748672e-05,COMPLETE
5,5,0.0,2025-01-26 21:09:38.627978,2025-01-26 21:10:08.817491,0 days 00:00:30.189513,,7,,,17,,0.2973243346544745,,0.0012548593198908888,,0.9780810792026231,RMSprop,3.0,fine_tuning,ReduceLROnPlateau,,0.5380377852807633,PRUNED
6,6,0.44664064049720764,2025-01-26 21:10:08.835208,2025-01-26 21:11:25.049917,0 days 00:01:16.214709,5.0,7,,,16,4.0935047202991817e-07,,,0.016998759580392438,,0.9201578015051693,SGD,,fine_tuning,CosineAnnealingLR,,1.0003658748852571e-05,COMPLETE
7,7,0.039867106825113297,2025-01-26 21:11:25.070394,2025-01-26 21:11:51.590084,0 days 00:00:26.519690,,6,,,17,,0.29754314502094625,,0.0035675054331891385,,0.9775188644231251,RMSprop,2.0,freezing,ReduceLROnPlateau,,0.10566344366433493,PRUNED
8,8,0.0,2025-01-26 21:11:51.608404,2025-01-26 21:12:15.403038,0 days 00:00:23.794634,,7,,,14,,0.13439332022060319,,0.0010523472087119428,,0.902710004059513,RMSprop,4.0,random,ReduceLROnPlateau,,0.11239553251294436,PRUNED
9,9,0.2320362627506256,2025-01-26 21:12:15.421015,2025-01-26 21:12:40.383163,0 days 00:00:24.962148,12.0,7,,,18,8.368075421103245e-07,,,0.04198573470793485,,0.9163819443057865,SGD,,freezing,CosineAnnealingLR,,3.626824917046231e-05,PRUNED
10,10,0.44971469044685364,2025-01-26 21:12:40.399774,2025-01-26 21:14:32.965243,0 days 00:01:52.565469,7.0,4,0.9916522872242333,0.9737743550994198,20,9.50738167719459e-06,,,0.00014503690487943202,,,Adam,,fine_tuning,CosineAnnealingLR,,,COMPLETE
11,11,0.39332816004753113,2025-01-26 21:14:32.983033,2025-01-26 21:15:52.757659,0 days 00:01:19.774626,7.0,4,0.9936397332704724,0.9839311332890537,20,9.44496798709591e-06,,,0.00010718292567854523,,,Adam,,fine_tuning,CosineAnnealingLR,,,PRUNED
12,12,0.3863847553730011,2025-01-26 21:15:52.775316,2025-01-26 21:17:15.627358,0 days 00:01:22.852042,9.0,4,0.9968723361913949,0.9654376077736261,20,9.941810316771702e-06,,,0.00011305690440034182,,,Adam,,fine_tuning,CosineAnnealingLR,,,PRUNED
13,13,0.4487198293209076,2025-01-26 21:17:15.645371,2025-01-26 21:18:16.431854,0 days 00:01:00.786483,9.0,5,0.9318257655083143,0.9041500363396027,11,3.193898907369555e-06,,,0.000291836366436134,,,AdamW,,fine_tuning,CosineAnnealingLR,,0.003105507729119679,COMPLETE
14,14,0.1480335295200348,2025-01-26 21:18:16.449381,2025-01-26 21:18:51.753369,0 days 00:00:35.303988,,5,0.804147150516792,0.9446937392650938,19,,,,0.00025532434284641475,0.0001003985682400659,,Adam,,fine_tuning,OneCycleLR,,,PRUNED
15,15,0.47827085852622986,2025-01-26 21:18:51.775798,2025-01-26 21:20:10.267911,0 days 00:01:18.492113,15.0,5,0.9588843542802646,0.9948162084056503,15,3.204418277677915e-06,,,0.0019266277334987654,,,Adam,,fine_tuning,CosineAnnealingLR,,,COMPLETE
16,16,0.37446197867393494,2025-01-26 21:20:10.285453,2025-01-26 21:20:42.145438,0 days 00:00:31.859985,14.0,5,0.9424360815196441,0.9973608664851793,15,2.38233048079099e-06,,,0.0021036003990551055,,,AdamW,,random,CosineAnnealingLR,,0.0029160509585285776,PRUNED
17,17,0.47351884841918945,2025-01-26 21:20:42.163228,2025-01-26 21:21:33.932463,0 days 00:00:51.769235,15.0,5,0.8639585571392074,0.9310524636111965,10,1.1473326027239338e-07,,,0.0004411114921624304,,,Adam,,fine_tuning,CosineAnnealingLR,,,COMPLETE
18,18,0.23642504215240479,2025-01-26 21:21:33.953959,2025-01-26 21:22:05.131874,0 days 00:00:31.177915,,6,0.9547958793693709,0.9514395376804866,15,,,,0.00192120805718038,0.0002820910173982703,,Adam,,fine_tuning,OneCycleLR,,,PRUNED
19,19,0.3982211947441101,2025-01-26 21:22:05.146554,2025-01-26 21:22:33.293720,0 days 00:00:28.147166,12.0,8,0.895590772204886,0.9103513871958088,12,2.9455904250870387e-06,,,0.0006458131266520119,,,Adam,,random,CosineAnnealingLR,,,PRUNED
20,20,0.30570918321609497,2025-01-26 21:22:33.311688,2025-01-26 21:23:02.817616,0 days 00:00:29.505928,12.0,7,0.9697488988939813,0.9254653382454502,14,3.979222855028674e-06,,,0.003837751649077621,,,AdamW,,fine_tuning,CosineAnnealingLR,,0.00473203512841107,PRUNED
21,21,0.4667831063270569,2025-01-26 21:23:02.838424,2025-01-26 21:23:55.190509,0 days 00:00:52.352085,15.0,5,0.8720570296048937,0.9346585708727722,10,1.8578160155849234e-07,,,0.0006195792839596481,,,Adam,,fine_tuning,CosineAnnealingLR,,,COMPLETE
22,22,0.4560544788837433,2025-01-26 21:23:55.209452,2025-01-26 21:24:47.682900,0 days 00:00:52.473448,15.0,5,0.8536930366707842,0.9186325785539378,10,1.6518957629912504e-07,,,0.0003875273131590453,,,Adam,,fine_tuning,CosineAnnealingLR,,,COMPLETE
23,23,0.48013389110565186,2025-01-26 21:24:47.700388,2025-01-26 21:26:09.552046,0 days 00:01:21.851658,13.0,5,0.8469295820557202,0.9463311404235408,16,1.236212124113362e-06,,,0.0016923021019144642,,,Adam,,fine_tuning,CosineAnnealingLR,,,COMPLETE
24,24,0.46955960988998413,2025-01-26 21:26:09.569239,2025-01-26 21:27:40.238406,0 days 00:01:30.669167,13.0,4,0.8337248076164896,0.9479751708243009,16,1.4714641261685808e-06,,,0.0017350295202041715,,,Adam,,fine_tuning,CosineAnnealingLR,,,COMPLETE
25,25,0.47076982259750366,2025-01-26 21:27:40.255964,2025-01-26 21:28:58.402811,0 days 00:01:18.146847,10.0,6,0.9065646407341942,0.9602286089629664,16,4.7955755153295954e-06,,,0.002654227961532903,,,Adam,,fine_tuning,CosineAnnealingLR,,,COMPLETE
26,26,0.43528714776039124,2025-01-26 21:28:58.420614,2025-01-26 21:29:49.611581,0 days 00:00:51.190967,,5,0.9585297192318942,0.9987589883175114,14,,,0.4941138117312453,0.0014873130489600043,,,Adam,,fine_tuning,StepLR,2.0,,PRUNED
27,27,0.48634710907936096,2025-01-26 21:29:49.629316,2025-01-26 21:31:18.518386,0 days 00:01:28.889070,,6,0.8911138990099644,0.9446153451306826,18,,,,0.0008276608949027664,0.009584411731951981,,Adam,,fine_tuning,OneCycleLR,,,COMPLETE
28,28,0.15421637892723083,2025-01-26 21:31:18.536203,2025-01-26 21:31:43.415962,0 days 00:00:24.879759,,7,0.8882095715826053,0.9392610681354623,18,,,,0.0008175405139229113,0.008004585776499618,,AdamW,,freezing,OneCycleLR,,0.0021484698643380058,PRUNED
29,29,0.14079494774341583,2025-01-26 21:31:43.432785,2025-01-26 21:32:13.054670,0 days 00:00:29.621885,,6,0.8389058165041977,0.9601426974902715,18,,,,0.0008372462855422009,0.0015540861617556955,,Adam,,random,OneCycleLR,,,PRUNED
30,30,0.164603129029274,2025-01-26 21:32:13.072138,2025-01-26 21:32:43.687991,0 days 00:00:30.615853,,6,0.8069109112918131,0.9166185276287738,19,,,,0.001209474425031155,0.001608481477749343,,Adam,,random,OneCycleLR,,,PRUNED
31,31,0.5010253190994263,2025-01-26 21:32:43.705329,2025-01-26 21:34:08.169617,0 days 00:01:24.464288,,5,0.9722727543924108,0.9421838077940791,16,,,,0.0029644157445611863,0.00903785536676663,,Adam,,fine_tuning,OneCycleLR,,,COMPLETE
32,32,0.4225275218486786,2025-01-26 21:34:08.187181,2025-01-26 21:34:47.117275,0 days 00:00:38.930094,,6,0.9724310582665541,0.940765344066672,16,,,,0.0056394299750537145,0.0066255575548344265,,Adam,,fine_tuning,OneCycleLR,,,PRUNED
33,33,0.4887832701206207,2025-01-26 21:34:47.134925,2025-01-26 21:36:19.040392,0 days 00:01:31.905467,,5,0.9242371170044364,0.9541641168381919,18,,,,0.002712460826026253,0.009803514012014729,,Adam,,fine_tuning,OneCycleLR,,,COMPLETE
34,34,0.4868265688419342,2025-01-26 21:36:19.062124,2025-01-26 21:37:43.683990,0 days 00:01:24.621866,,8,0.9298136755941784,0.9543188872780093,19,,,,0.005087367595304972,0.009884526949167917,,Adam,,fine_tuning,OneCycleLR,,,COMPLETE
35,35,0.06665947288274765,2025-01-26 21:37:43.703382,2025-01-26 21:38:08.141460,0 days 00:00:24.438078,,8,,,19,,,,0.004897569852644158,0.003348867203051894,0.9599624912257618,RMSprop,,freezing,OneCycleLR,,0.9567727117974231,PRUNED
36,36,0.3606257736682892,2025-01-26 21:38:08.158354,2025-01-26 21:38:36.266198,0 days 00:00:28.107844,,8,,,17,,,0.4406362818575221,0.00829180426985392,,0.9899232399633612,SGD,,fine_tuning,StepLR,2.0,0.0001780517516932834,PRUNED
37,37,0.3442702293395996,2025-01-26 21:38:36.283723,2025-01-26 21:39:03.445273,0 days 00:00:27.161550,,8,0.9392782091186657,0.9558620092073176,19,,,,0.002798762630703596,0.0027409267113137725,,Adam,,fine_tuning,OneCycleLR,,,PRUNED
38,38,0.11447929590940475,2025-01-26 21:39:03.464574,2025-01-26 21:39:28.373861,0 days 00:00:24.909287,,7,,,17,,,,0.006040791605645154,0.00905657801484208,0.9293898872716074,RMSprop,,freezing,OneCycleLR,,0.3408991443911715,PRUNED
39,39,0.4838326871395111,2025-01-26 21:39:28.390703,2025-01-26 21:40:50.645047,0 days 00:01:22.254344,,8,,,18,,0.48940729497110874,,0.00892345729734498,,0.932954670223172,SGD,5.0,fine_tuning,ReduceLROnPlateau,,0.00020528027179054107,COMPLETE
40,40,0.24964424967765808,2025-01-26 21:40:50.662648,2025-01-26 21:41:20.223335,0 days 00:00:29.560687,,7,0.918517256553972,0.9693043228322671,17,,,,0.003071923407571912,0.0005113189875155549,,Adam,,fine_tuning,OneCycleLR,,,PRUNED
41,41,0.4105163812637329,2025-01-26 21:41:20.241345,2025-01-26 21:41:49.646170,0 days 00:00:29.404825,,6,0.9768451353922806,0.9373468363853912,18,,,,0.002437058533115515,0.009898572405310432,,Adam,,fine_tuning,OneCycleLR,,,PRUNED
42,42,0.41031280159950256,2025-01-26 21:41:49.660950,2025-01-26 21:42:18.592643,0 days 00:00:28.931693,,7,0.9229121623666714,0.951369159250685,18,,,,0.0009461748259110512,0.005232015528116687,,Adam,,fine_tuning,OneCycleLR,,,PRUNED
43,43,0.4866155683994293,2025-01-26 21:42:18.610258,2025-01-26 21:43:48.902309,0 days 00:01:30.292051,,7,0.903151712133159,0.9268101309611362,19,,,,0.0013752543927034652,0.009421920126354325,,Adam,,fine_tuning,OneCycleLR,,,COMPLETE
44,44,0.4814079701900482,2025-01-26 21:43:48.923087,2025-01-26 21:45:18.889064,0 days 00:01:29.965977,,7,0.9094122916529914,0.9269402922201898,19,,,0.332103389601059,0.0013424338304523103,,,Adam,,fine_tuning,StepLR,3.0,,COMPLETE
45,45,0.43548160791397095,2025-01-26 21:45:18.906881,2025-01-26 21:46:26.416535,0 days 00:01:07.509654,,8,,,20,,0.4918674333384345,,0.007657631360051177,,0.9085832662837212,SGD,2.0,fine_tuning,ReduceLROnPlateau,,1.1335666011212432e-05,PRUNED
46,46,0.08682354539632797,2025-01-26 21:46:26.434049,2025-01-26 21:46:54.268507,0 days 00:00:27.834458,,4,,,19,,,,0.0035780992345245326,0.004834702343213715,0.9608104513845921,RMSprop,,freezing,OneCycleLR,,0.9186605497905616,PRUNED
47,47,0.40918582677841187,2025-01-26 21:46:54.285587,2025-01-26 21:47:20.966551,0 days 00:00:26.680964,,8,0.9455595793366528,0.9215330647601433,20,,,,0.004431686005056747,0.0031064276561719026,,Adam,,fine_tuning,OneCycleLR,,,PRUNED
48,48,0.40419137477874756,2025-01-26 21:47:20.984428,2025-01-26 21:47:49.169357,0 days 00:00:28.184929,,7,0.9296420107787905,0.9769275038126022,17,,,,0.0023996965882298257,0.0059297507357060995,,Adam,,fine_tuning,OneCycleLR,,,PRUNED
49,49,0.35823526978492737,2025-01-26 21:47:49.187124,2025-01-26 21:48:17.092301,0 days 00:00:27.905177,,7,0.9083867661450673,0.932067587281533,16,,,,0.0011681773807768574,0.009606771323127362,,AdamW,,random,OneCycleLR,,0.004675266818369221,PRUNED
50,50,0.4397786259651184,2025-01-26 21:48:17.110675,2025-01-26 21:49:29.483867,0 days 00:01:12.373192,,6,0.9790339102832462,0.9558108736906998,17,,0.10510497397626911,,0.0015129071900528263,,,Adam,5.0,fine_tuning,ReduceLROnPlateau,,,PRUNED
51,51,0.41795748472213745,2025-01-26 21:49:29.501595,2025-01-26 21:50:00.184494,0 days 00:00:30.682899,,5,0.8831069922652057,0.9415628693136294,18,,,,0.0006400823406924462,0.009421682539931312,,Adam,,fine_tuning,OneCycleLR,,,PRUNED
52,52,0.421654611825943,2025-01-26 21:50:00.202062,2025-01-26 21:50:29.217279,0 days 00:00:29.015217,,6,0.9858727200532856,0.9543356999736827,19,,,,0.0010073235797937198,0.006052233244724301,,Adam,,fine_tuning,OneCycleLR,,,PRUNED
53,53,0.4969477653503418,2025-01-26 21:50:29.234563,2025-01-26 21:52:09.139276,0 days 00:01:39.904713,,4,0.8951085797026672,0.9643733620698351,18,,,,0.0032563492380549546,0.0098440908844358,,Adam,,fine_tuning,OneCycleLR,,,COMPLETE
54,54,0.44846221804618835,2025-01-26 21:52:09.156921,2025-01-26 21:53:00.055747,0 days 00:00:50.898826,,4,0.9295478132062092,0.964570267467761,20,,,,0.0032206991130725652,0.006487536862731226,,Adam,,fine_tuning,OneCycleLR,,,PRUNED
55,55,0.3747636079788208,2025-01-26 21:53:00.073849,2025-01-26 21:53:33.529713,0 days 00:00:33.455864,,4,0.9008788014444801,0.9695709814285107,17,,,,0.004419021525633694,0.003975237083005424,,Adam,,fine_tuning,OneCycleLR,,,PRUNED
56,56,0.46851569414138794,2025-01-26 21:53:33.547992,2025-01-26 21:55:00.074367,0 days 00:01:26.526375,,4,0.8797007757384393,0.979536305713792,15,,,0.337382379711961,0.002165534945725761,,,Adam,,fine_tuning,StepLR,4.0,,COMPLETE
57,57,0.335542768239975,2025-01-26 21:55:00.095646,2025-01-26 21:55:34.862068,0 days 00:00:34.766422,,4,,,18,,,,0.0062104495457898,0.007057044780675552,0.9347651404866975,SGD,,fine_tuning,OneCycleLR,,2.408615206585611e-05,PRUNED
58,58,0.3982006311416626,2025-01-26 21:55:34.879714,2025-01-26 21:56:07.121724,0 days 00:00:32.242010,,5,0.9638399999286693,0.9607925317381735,19,,,,0.003247092632251086,0.0021515375377566415,,Adam,,fine_tuning,OneCycleLR,,,PRUNED
59,59,0.10744879394769669,2025-01-26 21:56:07.139472,2025-01-26 21:56:40.137164,0 days 00:00:32.997692,,5,0.9480102001360814,0.9296216699742713,17,,,,0.005357711796919217,0.0008427734777187711,,AdamW,,random,OneCycleLR,,0.0020230491145934856,PRUNED
60,60,0.013137169182300568,2025-01-26 21:56:40.155308,2025-01-26 21:57:15.620850,0 days 00:00:35.465542,,4,,,16,,0.3916665847499334,,0.0029502172272844623,,0.9598462031410736,RMSprop,4.0,fine_tuning,ReduceLROnPlateau,,0.6848338258069633,PRUNED
61,61,0.4376347064971924,2025-01-26 21:57:15.639406,2025-01-26 21:57:50.589582,0 days 00:00:34.950176,,6,0.8916925292906823,0.9442528897386419,18,,,,0.0005368616078050809,0.009864856341690372,,Adam,,fine_tuning,OneCycleLR,,,PRUNED
62,62,0.4823683500289917,2025-01-26 21:57:50.607115,2025-01-26 21:59:19.293013,0 days 00:01:28.685898,,6,0.9158879820937615,0.9347287501444914,18,,,,0.0008225103890413634,0.007092020799710532,,Adam,,fine_tuning,OneCycleLR,,,COMPLETE
63,63,0.3687901496887207,2025-01-26 21:59:19.310668,2025-01-26 21:59:49.067197,0 days 00:00:29.756529,,7,0.9967624782720401,0.9515358894738328,19,,,,0.003912842825993633,0.004436376979661778,,Adam,,fine_tuning,OneCycleLR,,,PRUNED
64,64,0.43598100543022156,2025-01-26 21:59:49.084860,2025-01-26 22:00:36.972459,0 days 00:00:47.887599,,5,0.8713953480337296,0.9441617201900635,18,,,,0.0017568611529063284,0.007142704400849304,,Adam,,fine_tuning,OneCycleLR,,,PRUNED
65,65,0.4896366000175476,2025-01-26 22:00:36.990423,2025-01-26 22:02:11.592441,0 days 00:01:34.602018,,7,0.9009665346529828,0.9487254266437686,20,,,,0.00038094188210672006,0.009952225164783873,,Adam,,fine_tuning,OneCycleLR,,,COMPLETE
66,66,0.0476992204785347,2025-01-26 22:02:11.610285,2025-01-26 22:02:40.634749,0 days 00:00:29.024464,,7,0.8988456427378292,0.9223616350670222,20,,,,0.0003116427801023296,0.00012885121706641977,,Adam,,freezing,OneCycleLR,,,PRUNED
67,67,0.36798542737960815,2025-01-26 22:02:40.652236,2025-01-26 22:03:09.878864,0 days 00:00:29.226628,5.0,7,0.9149156171027136,0.9633513227968925,20,6.659574813347964e-07,,,0.0001712578523694773,,,Adam,,fine_tuning,CosineAnnealingLR,,,PRUNED
68,68,0.3872527778148651,2025-01-26 22:03:09.898056,2025-01-26 22:03:37.747184,0 days 00:00:27.849128,,8,0.9374490402584158,0.9491790038838529,19,,,0.05512531241434687,0.00022756904485696239,,,Adam,,fine_tuning,StepLR,3.0,,PRUNED
69,69,0.397324800491333,2025-01-26 22:03:37.764786,2025-01-26 22:04:05.503217,0 days 00:00:27.738431,,8,0.9016898609970863,0.9864752436214731,20,,,,0.0003607332630878492,0.0051070944030765855,,Adam,,fine_tuning,OneCycleLR,,,PRUNED
70,70,0.3901229202747345,2025-01-26 22:04:05.521190,2025-01-26 22:04:34.629830,0 days 00:00:29.108640,8.0,7,0.9530050092662883,0.9109445287944091,19,3.740402164582266e-07,,,0.0021477941455559806,,,Adam,,fine_tuning,CosineAnnealingLR,,,PRUNED
71,71,0.4798150360584259,2025-01-26 22:04:34.648340,2025-01-26 22:06:00.069083,0 days 00:01:25.420743,,6,0.8884073616951198,0.9361878790341961,17,,,,0.0007173177203597108,0.008856806488880258,,Adam,,fine_tuning,OneCycleLR,,,COMPLETE
72,72,0.48785078525543213,2025-01-26 22:06:00.087468,2025-01-26 22:07:26.595712,0 days 00:01:26.508244,,7,0.9244628931333485,0.9564390695310042,18,,,,0.0005570080389677297,0.0074955851774428485,,Adam,,fine_tuning,OneCycleLR,,,COMPLETE
73,73,0.38285553455352783,2025-01-26 22:07:26.613405,2025-01-26 22:07:55.361925,0 days 00:00:28.748520,,7,0.9240036298244282,0.958174682358882,16,,,,0.00038624951222314874,0.007102644700848421,,Adam,,fine_tuning,OneCycleLR,,,PRUNED
74,74,0.42594021558761597,2025-01-26 22:07:55.379693,2025-01-26 22:08:24.105073,0 days 00:00:28.725380,,7,0.9342847143881619,0.9681392259434863,19,,,,0.00045108213777693434,0.007500637314831271,,Adam,,fine_tuning,OneCycleLR,,,PRUNED
75,75,0.3879223167896271,2025-01-26 22:08:24.119752,2025-01-26 22:08:54.029714,0 days 00:00:29.909962,,7,0.9097538594731179,0.9485310921916501,18,,,,0.0004565787741524237,0.00807778495765919,,AdamW,,random,OneCycleLR,,0.00458435069871414,PRUNED
76,76,0.4376274049282074,2025-01-26 22:08:54.047702,2025-01-26 22:09:23.265324,0 days 00:00:29.217622,,7,0.9667518280992624,0.9529604223035154,17,,,,0.0014581381008312365,0.009926769590988514,,Adam,,fine_tuning,OneCycleLR,,,PRUNED
77,77,0.4255649745464325,2025-01-26 22:09:23.283023,2025-01-26 22:09:51.838235,0 days 00:00:28.555212,,8,0.9876713379402339,0.9574693929874097,19,,,,0.0005898067402315678,0.005898705913542277,,Adam,,fine_tuning,OneCycleLR,,,PRUNED
78,78,0.1000932976603508,2025-01-26 22:09:51.855870,2025-01-26 22:10:17.523913,0 days 00:00:25.668043,6.0,7,,,18,1.968784173282563e-06,,,0.001153839595937464,,0.9228373860745119,RMSprop,,freezing,CosineAnnealingLR,,0.3018233365500979,PRUNED
79,79,0.33662664890289307,2025-01-26 22:10:17.540837,2025-01-26 22:10:49.284475,0 days 00:00:31.743638,,5,,,20,,,,0.007045976849827247,0.0038271678689728553,0.9866221649693389,SGD,,fine_tuning,OneCycleLR,,0.0004352793018517595,PRUNED
80,80,0.49307146668434143,2025-01-26 22:10:49.302066,2025-01-26 22:12:00.913998,0 days 00:01:11.611932,,7,0.9246391541770189,0.9324196507880589,15,,,,0.00023100736981671897,0.007505531546925194,,Adam,,fine_tuning,OneCycleLR,,,COMPLETE
81,81,0.4160403907299042,2025-01-26 22:12:00.932822,2025-01-26 22:12:30.053709,0 days 00:00:29.120887,,7,0.9186980104017106,0.924914564783921,16,,,,0.00022022211111756847,0.007897930963649508,,Adam,,fine_tuning,OneCycleLR,,,PRUNED
82,82,0.4449732005596161,2025-01-26 22:12:30.071445,2025-01-26 22:13:13.039000,0 days 00:00:42.967555,,7,0.9254739318343473,0.9303553018917827,14,,,,0.00015231157623845786,0.007957117204104726,,Adam,,fine_tuning,OneCycleLR,,,PRUNED
83,83,0.40002715587615967,2025-01-26 22:13:13.057301,2025-01-26 22:13:41.672028,0 days 00:00:28.614727,,7,0.9494841986332038,0.9416111455270074,15,,,,0.0003383677172624636,0.005610248452468204,,Adam,,fine_tuning,OneCycleLR,,,PRUNED
84,84,0.4852200448513031,2025-01-26 22:13:41.689864,2025-01-26 22:14:52.713389,0 days 00:01:11.023525,,7,0.9062140858148894,0.933761476184809,15,,,,0.0002542399566726216,0.008260255662631668,,Adam,,fine_tuning,OneCycleLR,,,COMPLETE
85,85,0.48624834418296814,2025-01-26 22:14:52.731184,2025-01-26 22:15:52.191292,0 days 00:00:59.460108,,8,0.9584593026499281,0.937848622962386,13,,,,0.0024928385749683557,0.009703641021967573,,Adam,,fine_tuning,OneCycleLR,,,COMPLETE
86,86,0.49573376774787903,2025-01-26 22:15:52.209026,2025-01-26 22:17:14.216874,0 days 00:01:22.007848,,6,0.8947957589257178,0.9623282544497956,16,,0.21260938975427907,,0.0007315186138202107,,,Adam,3.0,fine_tuning,ReduceLROnPlateau,,,COMPLETE
87,87,0.47305217385292053,2025-01-26 22:17:14.234633,2025-01-26 22:18:28.568903,0 days 00:01:14.334270,,6,0.8802410278649954,0.9627252344050019,15,,0.21261400600108452,,0.0007156647890100872,,,Adam,3.0,fine_tuning,ReduceLROnPlateau,,,COMPLETE
88,88,0.4851032495498657,2025-01-26 22:18:28.587325,2025-01-26 22:19:48.741131,0 days 00:01:20.153806,,6,0.913633524367558,0.9677620252414301,16,,0.2114796224325744,,0.0009036865403590844,,,Adam,3.0,fine_tuning,ReduceLROnPlateau,,,COMPLETE
89,89,0.34705737233161926,2025-01-26 22:19:48.762887,2025-01-26 22:20:21.690790,0 days 00:00:32.927903,,5,0.8952577786228441,0.973362309944766,14,,0.20791301693164246,,0.0005187747275683994,,,Adam,2.0,random,ReduceLROnPlateau,,,PRUNED
