,number,value,datetime_start,datetime_complete,duration,params_T_max,params_batch_size,params_beta1,params_beta2,params_epochs,params_eta_min,params_factor,params_gamma,params_lr,params_max_lr,params_momentum,params_optimizer,params_patience,params_preweight_mode,params_scheduler,params_step_size,params_weight_decay,state
87,87,0.5077376365661621,2025-01-26 20:50:44.638684,2025-01-26 20:51:39.299993,0 days 00:00:54.661309,,5,0.8588914873247442,0.9555176156331359,10,,,,0.00011406707485846111,0.001003244994186791,,AdamW,,fine_tuning,OneCycleLR,,0.004802907358097496,PRUNED
88,88,0.5149140954017639,2025-01-26 20:51:39.316071,2025-01-26 20:52:35.635329,0 days 00:00:56.319258,,4,0.8417224574711363,0.9932705471594409,20,,,,0.00018921880355507443,0.0020372958405364206,,AdamW,,fine_tuning,OneCycleLR,,0.0024299206326679366,PRUNED
89,89,0.4274875819683075,2025-01-26 20:52:35.651377,2025-01-26 20:53:10.161969,0 days 00:00:34.510592,12.0,4,0.8491833078609372,0.9730914475082691,20,4.217519753266451e-07,,,0.00029621536431128525,,,Adam,,fine_tuning,CosineAnnealingLR,,,PRUNED
90,90,0.482605516910553,2025-01-26 20:53:10.176746,2025-01-26 20:53:59.394482,0 days 00:00:49.217736,,5,0.904564326827852,0.9438251454591177,19,,,,0.0003538702858846254,0.0006714294616745233,,AdamW,,fine_tuning,OneCycleLR,,0.002854278515593882,PRUNED
91,91,0.47385936975479126,2025-01-26 20:53:59.411085,2025-01-26 20:54:53.993832,0 days 00:00:54.582747,,5,0.8619533401637554,0.9655499000201349,19,,,,0.00016073586213477726,0.0016190982905330356,,AdamW,,fine_tuning,OneCycleLR,,0.004506130732507872,PRUNED
92,92,0.55343097448349,2025-01-26 20:54:54.009773,2025-01-26 20:56:20.253872,0 days 00:01:26.244099,,5,0.8763930963527944,0.9598835418387692,20,,,,0.00021954202053902313,0.001966680900047703,,AdamW,,fine_tuning,OneCycleLR,,0.003674866546603229,PRUNED
93,93,0.5727643966674805,2025-01-26 20:56:20.269707,2025-01-26 20:58:03.724713,0 days 00:01:43.455006,,5,0.8327527110677814,0.9691178749265562,19,,,,0.00013156595246777603,0.0015029742924321998,,AdamW,,fine_tuning,OneCycleLR,,0.003276355311582465,COMPLETE
94,94,0.0,2025-01-26 20:58:03.752176,2025-01-26 20:58:32.916803,0 days 00:00:29.164627,,4,0.8524350818279507,0.9769378491428155,20,,,,0.00014860580398216833,0.00403349706624896,,AdamW,,random,OneCycleLR,,0.002234956101981899,PRUNED
95,95,0.5819387435913086,2025-01-26 20:58:32.932331,2025-01-26 21:00:11.228811,0 days 00:01:38.296480,,5,0.8384538002068835,0.9537393226703954,18,,,,0.0028331286362261927,0.002548886917677969,,AdamW,,fine_tuning,OneCycleLR,,0.005273995501127284,COMPLETE
96,96,0.0,2025-01-26 21:00:11.247617,2025-01-26 21:00:46.436733,0 days 00:00:35.189116,,4,0.995132872784851,0.9662212358343297,19,,0.39340245735999224,,0.0004668567843256827,,,AdamW,2.0,fine_tuning,ReduceLROnPlateau,,0.001956953414459094,PRUNED
97,97,0.6027449369430542,2025-01-26 21:00:46.452872,2025-01-26 21:02:38.580523,0 days 00:01:52.127651,,4,0.8195653809487391,0.9707395966525612,20,,,,0.000255204477160872,0.0032033229693134743,,AdamW,,fine_tuning,OneCycleLR,,0.004055218753815365,COMPLETE
98,98,0.3738580644130707,2025-01-26 21:02:38.605357,2025-01-26 21:03:13.593533,0 days 00:00:34.988176,,4,0.8217880521118166,0.9036467913532525,20,,,,0.0002048888963829633,0.0033423226430075274,,AdamW,,fine_tuning,OneCycleLR,,0.006184647872668886,PRUNED
99,99,0.00961421150714159,2025-01-26 21:03:13.609402,2025-01-26 21:03:45.679326,0 days 00:00:32.069924,,4,,,20,,,,0.0010243608634712559,0.0029056640684050525,0.9358496286186168,RMSprop,,freezing,OneCycleLR,,0.10152521638510535,PRUNED
