,number,value,datetime_start,datetime_complete,duration,params_T_max,params_batch_size,params_beta1,params_beta2,params_epochs,params_eta_min,params_factor,params_gamma,params_lr,params_max_lr,params_momentum,params_optimizer,params_patience,params_preweight_mode,params_scheduler,params_step_size,params_weight_decay,state
0,0,0.0,2025-01-28 05:42:27.093047,2025-01-28 05:44:06.130543,0 days 00:01:39.037496,8.0,7,0.9658118084445251,0.9318563294010559,17,8.307341815284441e-06,,,0.0009472961959721175,,,Adam,,fine_tuning,CosineAnnealingLR,,,PRUNED
1,1,0.3205864131450653,2025-01-28 05:44:06.147601,2025-01-28 05:48:25.070342,0 days 00:04:18.922741,,6,0.9169765854389738,0.9282853454922604,13,,,0.16714116943161034,0.0004904539339172869,,,Adam,,random,StepLR,5.0,,COMPLETE
2,2,0.06949509680271149,2025-01-28 05:48:25.098604,2025-01-28 05:51:54.988042,0 days 00:03:29.889438,,8,,,17,,,0.17734318931932058,0.004241247429282568,,0.9492067843282642,RMSprop,,freezing,StepLR,5.0,0.1260926568334326,COMPLETE
3,3,0.0,2025-01-28 05:51:55.006878,2025-01-28 05:52:56.912544,0 days 00:01:01.905666,,8,,,13,,,0.056083539958035666,0.04948808716982222,,0.9468789822431335,SGD,,freezing,StepLR,5.0,5.129973236412686e-05,PRUNED
4,4,0.6044257283210754,2025-01-28 05:52:56.928494,2025-01-28 05:58:34.498691,0 days 00:05:37.570197,,6,,,17,,,,0.02344308086614435,0.004548729885792942,0.9727457317944981,SGD,,fine_tuning,OneCycleLR,,4.760099310748672e-05,COMPLETE
5,5,0.0,2025-01-28 05:58:34.524717,2025-01-28 06:00:12.253586,0 days 00:01:37.728869,,7,,,17,,0.2973243346544745,,0.0012548593198908888,,0.9780810792026231,RMSprop,3.0,fine_tuning,ReduceLROnPlateau,,0.5380377852807633,PRUNED
6,6,0.0,2025-01-28 06:00:12.269740,2025-01-28 06:01:49.425316,0 days 00:01:37.155576,5.0,7,,,16,4.0935047202991817e-07,,,0.016998759580392438,,0.9201578015051693,SGD,,fine_tuning,CosineAnnealingLR,,1.0003658748852571e-05,PRUNED
7,7,0.0,2025-01-28 06:01:49.440205,2025-01-28 06:02:52.211657,0 days 00:01:02.771452,,6,,,17,,0.29754314502094625,,0.0035675054331891385,,0.9775188644231251,RMSprop,2.0,freezing,ReduceLROnPlateau,,0.10566344366433493,PRUNED
8,8,0.0,2025-01-28 06:02:52.227615,2025-01-28 06:04:29.808320,0 days 00:01:37.580705,,7,,,14,,0.13439332022060319,,0.0010523472087119428,,0.902710004059513,RMSprop,4.0,random,ReduceLROnPlateau,,0.11239553251294436,PRUNED
9,9,0.0024045261088758707,2025-01-28 06:04:29.826756,2025-01-28 06:08:15.190848,0 days 00:03:45.364092,12.0,7,,,18,8.368075421103245e-07,,,0.04198573470793485,,0.9163819443057865,SGD,,freezing,CosineAnnealingLR,,3.626824917046231e-05,COMPLETE
10,10,0.6168383955955505,2025-01-28 06:08:15.216904,2025-01-28 06:15:03.662715,0 days 00:06:48.445811,,4,0.8384084637388263,0.9966465871541936,20,,,,0.00016363071798730853,0.005598622137471745,,AdamW,,fine_tuning,OneCycleLR,,0.002334540139946281,COMPLETE
11,11,0.6038646697998047,2025-01-28 06:15:03.688661,2025-01-28 06:21:51.800813,0 days 00:06:48.112152,,4,0.8073762627164024,0.9982384196518811,20,,,,0.00010718292567854523,0.0061326515808014966,,AdamW,,fine_tuning,OneCycleLR,,0.002655109109652821,COMPLETE
12,12,0.6487302184104919,2025-01-28 06:21:51.826917,2025-01-28 06:28:39.431690,0 days 00:06:47.604773,,4,0.8208343757368655,0.9971972742795927,20,,,,0.00011305690440034182,0.004816011775762198,,AdamW,,fine_tuning,OneCycleLR,,0.002993592026470708,COMPLETE
13,13,0.6869381666183472,2025-01-28 06:28:39.457649,2025-01-28 06:35:27.845289,0 days 00:06:48.387640,,4,0.8112220802572861,0.9964953329460849,20,,,,0.00012287007194869702,0.00045222212584773236,,AdamW,,fine_tuning,OneCycleLR,,0.0027533502069439476,COMPLETE
14,14,0.60393226146698,2025-01-28 06:35:27.872272,2025-01-28 06:39:12.287858,0 days 00:03:44.415586,,5,0.8525586875897603,0.970214555589609,11,,,,0.0002392570945153689,0.0002817003831366889,,AdamW,,fine_tuning,OneCycleLR,,0.0032241665775548708,COMPLETE
15,15,0.6771969199180603,2025-01-28 06:39:12.313605,2025-01-28 06:45:38.044969,0 days 00:06:25.731364,,5,0.8103411041128947,0.9672973162257021,19,,,,0.00034801533967284066,0.000571985165442484,,AdamW,,fine_tuning,OneCycleLR,,0.003782657316921071,COMPLETE
16,16,0.39145225286483765,2025-01-28 06:45:38.072567,2025-01-28 06:47:40.579000,0 days 00:02:02.506433,,5,0.8818612032765758,0.9637283254107746,19,,,,0.00033216788233721427,0.000497595564736712,,AdamW,,random,OneCycleLR,,0.004426143368203563,PRUNED
17,17,0.45874345302581787,2025-01-28 06:47:40.596069,2025-01-28 06:49:43.098593,0 days 00:02:02.502524,,5,0.871457407342031,0.9008994860793419,19,,,,0.0004996585972379221,0.00011206340683480459,,AdamW,,fine_tuning,OneCycleLR,,0.005404375189394669,PRUNED
18,18,0.7036852836608887,2025-01-28 06:49:43.115730,2025-01-28 06:54:47.651596,0 days 00:05:04.535866,,5,0.8013068308179178,0.9720402624674394,15,,,,0.0002230213417328582,0.0012431656734459198,,AdamW,,fine_tuning,OneCycleLR,,0.0019047317907887917,COMPLETE
19,19,0.4604359269142151,2025-01-28 06:54:47.677540,2025-01-28 06:56:50.148758,0 days 00:02:02.471218,,4,0.9211922681879989,0.9756628595726212,15,,,,0.0001664393396715237,0.0017819303539894423,,AdamW,,random,OneCycleLR,,0.0020629255825188614,PRUNED
20,20,0.6739327907562256,2025-01-28 06:56:50.166324,2025-01-28 07:00:13.304896,0 days 00:03:23.138572,,5,0.8441160726945429,0.9831579048422802,10,,,,0.00019189007646989127,0.0015020797037747183,,Adam,,fine_tuning,OneCycleLR,,,COMPLETE
21,21,0.6719498038291931,2025-01-28 07:00:13.330877,2025-01-28 07:05:18.493037,0 days 00:05:05.162160,,5,0.8094542818757702,0.9511579402655884,15,,,,0.00033316281124793506,0.0005637636471352483,,AdamW,,fine_tuning,OneCycleLR,,0.0017046177025950367,COMPLETE
22,22,0.708175778388977,2025-01-28 07:05:18.519689,2025-01-28 07:11:47.146092,0 days 00:06:28.626403,,4,0.8025380583776541,0.9492122646880801,19,,,,0.0005692594539260657,0.0007943261076417524,,AdamW,,fine_tuning,OneCycleLR,,0.0037939666299910213,COMPLETE
23,23,0.7002168893814087,2025-01-28 07:11:47.171902,2025-01-28 07:16:33.505693,0 days 00:04:46.333791,,4,0.8010003896849052,0.9489394661997361,14,,,,0.0006794912016918528,0.0012906328240813308,,AdamW,,fine_tuning,OneCycleLR,,0.0018545908551442923,COMPLETE
24,24,0.6550431251525879,2025-01-28 07:16:33.531334,2025-01-28 07:20:59.714554,0 days 00:04:26.183220,,4,0.8007288017852431,0.9495431780129384,13,,,,0.000670709732747404,0.0019061428115903867,,AdamW,,fine_tuning,OneCycleLR,,0.0015760925205771804,COMPLETE
25,25,0.6621149778366089,2025-01-28 07:20:59.733822,2025-01-28 07:25:47.823910,0 days 00:04:48.090088,,4,0.9970713135205814,0.935681570521393,14,,,,0.0015247943368686186,0.0010449140718191826,,AdamW,,fine_tuning,OneCycleLR,,0.001589525316679436,COMPLETE
26,26,0.11862912774085999,2025-01-28 07:25:47.850586,2025-01-28 07:27:49.661753,0 days 00:02:01.811167,,5,0.8293538782173512,0.9573662615092943,12,,,0.49173498762183987,0.0006902548653020352,,,AdamW,,fine_tuning,StepLR,2.0,0.0020294629020389757,PRUNED
27,27,0.019801979884505272,2025-01-28 07:27:49.678938,2025-01-28 07:29:51.953313,0 days 00:02:02.274375,,4,0.8607876441960273,0.9380977736524884,16,,0.4963130924171012,,0.0019817505454996997,,,AdamW,5.0,random,ReduceLROnPlateau,,0.0012750781522213853,PRUNED
28,28,0.13255949318408966,2025-01-28 07:29:51.970136,2025-01-28 07:31:08.982284,0 days 00:01:17.012148,15.0,5,0.8336695692681395,0.9441122446892218,14,9.774061413997328e-06,,,0.0004981490658537592,,,Adam,,freezing,CosineAnnealingLR,,,PRUNED
29,29,0.0836869403719902,2025-01-28 07:31:08.999459,2025-01-28 07:33:11.410448,0 days 00:02:02.410989,10.0,4,0.8262775696875976,0.9155615500936858,16,1.0109297539330419e-07,,,0.0006922481486704321,,,Adam,,fine_tuning,CosineAnnealingLR,,,PRUNED
30,30,0.6963804364204407,2025-01-28 07:33:11.427728,2025-01-28 07:38:11.492386,0 days 00:05:00.064658,,6,0.8938727712913946,0.9574868620452767,15,,,,0.00026090099949327287,0.0023865224560466244,,AdamW,,fine_tuning,OneCycleLR,,0.005639524896248184,COMPLETE
31,31,0.6517886519432068,2025-01-28 07:38:11.518305,2025-01-28 07:43:11.902407,0 days 00:05:00.384102,,6,0.8957924631343345,0.9782207593612686,15,,,,0.0002514955417238598,0.002865799193967723,,AdamW,,fine_tuning,OneCycleLR,,0.00505479651355617,COMPLETE
32,32,0.7044711709022522,2025-01-28 07:43:11.929006,2025-01-28 07:47:52.108400,0 days 00:04:40.179394,,6,0.9626073489954293,0.9573660042713656,14,,,,0.0003760777898928763,0.0009409525174701209,,AdamW,,fine_tuning,OneCycleLR,,0.006139137763837934,COMPLETE
33,33,0.6663370728492737,2025-01-28 07:47:52.134264,2025-01-28 07:51:51.921794,0 days 00:03:59.787530,,6,0.95785021695061,0.9569335175784239,12,,,,0.0008468448683316568,0.0008524690053133421,,AdamW,,fine_tuning,OneCycleLR,,0.00714168280746391,COMPLETE
34,34,0.07260726392269135,2025-01-28 07:51:51.948071,2025-01-28 07:53:53.777066,0 days 00:02:01.828995,,5,0.9548961446502285,0.9453105246920421,14,,,0.4431384512901454,0.00046224983447295626,,,AdamW,,fine_tuning,StepLR,2.0,0.007276032508439814,PRUNED
35,35,0.6750814914703369,2025-01-28 07:53:53.794019,2025-01-28 07:58:05.972309,0 days 00:04:12.178290,,8,0.9978815648902863,0.9850520641960991,13,,,,0.00040238392963484764,0.0010048206126411345,,Adam,,fine_tuning,OneCycleLR,,,COMPLETE
36,36,0.0,2025-01-28 07:58:05.998169,2025-01-28 07:59:08.875174,0 days 00:01:02.877005,,6,,,12,,,0.3586453883496105,0.005747711642090413,,0.9588815174666938,SGD,,freezing,StepLR,3.0,0.0007199381909687463,PRUNED
37,37,0.0,2025-01-28 07:59:08.891182,2025-01-28 08:00:50.844008,0 days 00:01:41.952826,,4,,,16,,,,0.0013941025280718772,0.001153736624604942,0.9303396115608304,RMSprop,,fine_tuning,OneCycleLR,,0.10700278747303556,PRUNED
38,38,0.23811955749988556,2025-01-28 08:00:50.858740,2025-01-28 08:02:53.205691,0 days 00:02:02.346951,,5,0.937202921114664,0.9633035238342746,13,,,,0.0006390252727842508,0.00029699087273132646,,AdamW,,random,OneCycleLR,,0.003756149931044296,PRUNED
39,39,0.0,2025-01-28 08:02:53.222464,2025-01-28 08:04:31.262520,0 days 00:01:38.040056,,6,,,14,,0.4959889231585858,,0.0012349036765374618,,0.9892451355920723,RMSprop,5.0,fine_tuning,ReduceLROnPlateau,,0.10595962034580517,PRUNED
40,40,0.04788348451256752,2025-01-28 08:04:31.279749,2025-01-28 08:05:49.138786,0 days 00:01:17.859037,15.0,4,,,18,2.053187079237173e-06,,,0.005828508509268079,,0.9328620591859513,SGD,,freezing,CosineAnnealingLR,,0.0007321254844164243,PRUNED
41,41,0.6493569612503052,2025-01-28 08:05:49.155199,2025-01-28 08:10:49.002578,0 days 00:04:59.847379,,6,0.9765128703055812,0.955164681672317,15,,,,0.0002700567266678838,0.002884215734657276,,AdamW,,fine_tuning,OneCycleLR,,0.006474388513621538,COMPLETE
42,42,0.6644259095191956,2025-01-28 08:10:49.029045,2025-01-28 08:15:48.910784,0 days 00:04:59.881739,,6,0.8004701438860323,0.9431143331429197,15,,,,0.00019903741597595144,0.0023583693435814076,,AdamW,,fine_tuning,OneCycleLR,,0.005801894208048423,COMPLETE
43,43,0.694386899471283,2025-01-28 08:15:48.936636,2025-01-28 08:21:07.867167,0 days 00:05:18.930531,,7,0.9067424120468985,0.9585456183166065,16,,,,0.0008864601670549517,0.0007877070812423081,,AdamW,,fine_tuning,OneCycleLR,,0.009354146231520328,COMPLETE
44,44,0.6768453121185303,2025-01-28 08:21:07.893030,2025-01-28 08:25:47.240373,0 days 00:04:39.347343,,6,0.9354803763596495,0.9706639278205198,14,,,,0.0005449279235933514,0.0014033466568091476,,AdamW,,fine_tuning,OneCycleLR,,0.008202145799585297,COMPLETE
45,45,0.5591145157814026,2025-01-28 08:25:47.266688,2025-01-28 08:28:07.287235,0 days 00:02:20.020547,,7,0.8170347335239692,0.9302539603924144,17,,,,0.0004087016730936206,0.0007424213376721763,,AdamW,,fine_tuning,OneCycleLR,,0.0038801972608113753,PRUNED
46,46,0.0,2025-01-28 08:28:07.304317,2025-01-28 08:29:45.712672,0 days 00:01:38.408355,,6,,,15,,0.10974878784756065,,0.0011464328647960709,,0.9021699316999451,RMSprop,2.0,fine_tuning,ReduceLROnPlateau,,0.1038798424158351,PRUNED
47,47,0.0,2025-01-28 08:29:45.729714,2025-01-28 08:31:20.672070,0 days 00:01:34.942356,,8,,,13,,,0.30379175314115,0.005451169488116755,,0.9616232785386751,SGD,,fine_tuning,StepLR,4.0,0.0007956080866046294,PRUNED
48,48,0.23459139466285706,2025-01-28 08:31:20.688706,2025-01-28 08:32:38.086243,0 days 00:01:17.397537,,5,0.8844153972779051,0.951343318875066,18,,,,0.00014083246464223858,0.0012890922830131634,,AdamW,,freezing,OneCycleLR,,0.0044577106215340995,PRUNED
49,49,0.5678281188011169,2025-01-28 08:32:38.102702,2025-01-28 08:37:23.426800,0 days 00:04:45.324098,,4,0.9815150765119087,0.9246004369017686,16,,,,0.00030400291866874686,0.0034603831706765025,,AdamW,,fine_tuning,OneCycleLR,,0.004839999355214404,PRUNED
50,50,0.12157373875379562,2025-01-28 08:37:23.443605,2025-01-28 08:39:23.277352,0 days 00:01:59.833747,,6,0.8451758620608841,0.9415680005788224,15,,,,0.0002054123331355746,0.009636034928702995,,AdamW,,random,OneCycleLR,,0.00902462058752707,PRUNED
51,51,0.6752590537071228,2025-01-28 08:39:23.294321,2025-01-28 08:44:42.288727,0 days 00:05:18.994406,,7,0.91762846426008,0.9607478694260146,16,,,,0.0008243798300358537,0.0007435545246975778,,AdamW,,fine_tuning,OneCycleLR,,0.00793152370610134,COMPLETE
52,52,0.6974040269851685,2025-01-28 08:44:42.315002,2025-01-28 08:49:14.866950,0 days 00:04:32.551948,,8,0.9382915866039162,0.9571422004706215,14,,,,0.00039099662753345717,0.002018561091457639,,AdamW,,fine_tuning,OneCycleLR,,0.006110164864980483,COMPLETE
53,53,0.6960198283195496,2025-01-28 08:49:14.897745,2025-01-28 08:53:47.407795,0 days 00:04:32.510050,,8,0.9396408980937384,0.9512237918002876,14,,,,0.00039597516967840497,0.0020309247733439105,,AdamW,,fine_tuning,OneCycleLR,,0.006256130962790447,COMPLETE
54,54,0.6957890391349792,2025-01-28 08:53:47.434108,2025-01-28 08:58:26.669363,0 days 00:04:39.235255,,7,0.9685862598604607,0.9684627652939144,14,,,,0.0002768338471208363,0.001389543065569723,,AdamW,,fine_tuning,OneCycleLR,,0.005744647419404691,COMPLETE
55,55,0.5816754698753357,2025-01-28 08:58:26.695422,2025-01-28 09:00:49.836890,0 days 00:02:23.141468,,5,0.9480215964245782,0.9638540968986102,13,,,,0.0006088739216453101,0.0036824831730766293,,AdamW,,fine_tuning,OneCycleLR,,0.0024090094084903034,PRUNED
56,56,0.6099180579185486,2025-01-28 09:00:49.851414,2025-01-28 09:05:36.656072,0 days 00:04:46.804658,,4,0.8195247725615902,0.9551970972988463,15,,,,0.0002354210452746504,0.0023072097494339565,,AdamW,,fine_tuning,OneCycleLR,,0.0032246116261477604,PRUNED
57,57,0.4582388699054718,2025-01-28 09:05:36.673889,2025-01-28 09:07:36.800601,0 days 00:02:00.126712,5.0,6,0.9285214714723484,0.946580814284765,13,1.1941874103963074e-07,,,0.00036944511064146136,,,AdamW,,fine_tuning,CosineAnnealingLR,,0.001873548361850492,PRUNED
58,58,0.7057774066925049,2025-01-28 09:07:36.817606,2025-01-28 09:11:36.058377,0 days 00:03:59.240771,,7,0.813638485980461,0.972935330965576,12,,,,0.00014174816884172513,0.0016901339985445445,,Adam,,fine_tuning,OneCycleLR,,,COMPLETE
59,59,0.45301854610443115,2025-01-28 09:11:36.084121,2025-01-28 09:13:33.023667,0 days 00:01:56.939546,,8,0.8143746723744023,0.9881664650809933,11,,0.38630827894523556,,0.00013734404631307956,,,Adam,4.0,random,ReduceLROnPlateau,,,PRUNED
60,60,0.6930407881736755,2025-01-28 09:13:33.040495,2025-01-28 09:16:47.806091,0 days 00:03:14.765596,,8,0.8007774311957649,0.9747655691443196,10,,,,0.0001508403922157344,0.0016696027739685135,,Adam,,fine_tuning,OneCycleLR,,,COMPLETE
61,61,0.642021656036377,2025-01-28 09:16:47.831655,2025-01-28 09:20:27.405501,0 days 00:03:39.573846,,7,0.8094392322941849,0.9660101351330738,11,,,,0.00016965448038953662,0.001183878163474755,,Adam,,fine_tuning,OneCycleLR,,,COMPLETE
62,62,0.6929953694343567,2025-01-28 09:20:27.432088,2025-01-28 09:26:05.987765,0 days 00:05:38.555677,,7,0.8237344572749288,0.9737822268438332,17,,,,0.00021929251318924747,0.0008972439750026684,,Adam,,fine_tuning,OneCycleLR,,,COMPLETE
63,63,0.6711291670799255,2025-01-28 09:26:06.018964,2025-01-28 09:30:45.112459,0 days 00:04:39.093495,,7,0.8381003069300653,0.98133575238064,14,,,,0.0001015693446858783,0.002554066530504865,,AdamW,,fine_tuning,OneCycleLR,,0.0013022533013505116,COMPLETE
64,64,0.6747947335243225,2025-01-28 09:30:45.139117,2025-01-28 09:35:36.804504,0 days 00:04:51.665387,,8,0.857086051746283,0.961026886251196,15,,,,0.0003031040322200892,0.0016865723460986466,,Adam,,fine_tuning,OneCycleLR,,,COMPLETE
65,65,0.6667386889457703,2025-01-28 09:35:36.831240,2025-01-28 09:39:42.925491,0 days 00:04:06.094251,,4,0.8072974198869285,0.952239336147121,12,,,,0.00044352634161977025,0.0006746256322182042,,AdamW,,fine_tuning,OneCycleLR,,0.004504153989808055,COMPLETE
66,66,0.32744911313056946,2025-01-28 09:39:42.951552,2025-01-28 09:41:44.544840,0 days 00:02:01.593288,,5,,,14,,,,0.005237261165140769,0.0010524522627600181,0.934878322514581,SGD,,fine_tuning,OneCycleLR,,0.0008693507084934931,PRUNED
67,67,0.0,2025-01-28 09:41:44.561311,2025-01-28 09:43:00.171404,0 days 00:01:15.610093,,6,,,13,,,0.19695556591680874,0.0010889207308013254,,0.9144824783783048,RMSprop,,freezing,StepLR,3.0,0.11957800191336601,PRUNED
68,68,0.5631216168403625,2025-01-28 09:43:00.187642,2025-01-28 09:45:19.884532,0 days 00:02:19.696890,,7,0.985353523471836,0.9355608533825746,12,,,,0.00018368764826444422,0.0020873961647855763,,AdamW,,fine_tuning,OneCycleLR,,0.006655385748178988,PRUNED
69,69,0.7266784906387329,2025-01-28 09:45:19.901708,2025-01-28 09:50:06.708991,0 days 00:04:46.807283,12.0,4,0.9084446978867835,0.9924954809481307,14,3.0098221253759324e-06,,,0.00011989966633060178,,,AdamW,,fine_tuning,CosineAnnealingLR,,0.003485272575990577,COMPLETE
70,70,0.649143397808075,2025-01-28 09:50:06.735301,2025-01-28 09:54:51.701843,0 days 00:04:44.966542,,4,0.9095346099072033,0.9897338824986153,14,,0.2056073571889243,,0.00011668319005268925,,,Adam,3.0,fine_tuning,ReduceLROnPlateau,,,COMPLETE
71,71,0.6849149465560913,2025-01-28 09:54:51.728584,2025-01-28 09:59:58.000077,0 days 00:05:06.271493,12.0,4,0.8776874635936142,0.9942389613558605,15,2.514406806097385e-06,,,0.0001284347585334911,,,AdamW,,fine_tuning,CosineAnnealingLR,,0.0035089974929615126,COMPLETE
72,72,0.10616640746593475,2025-01-28 09:59:58.029983,2025-01-28 10:02:00.616220,0 days 00:02:02.586237,12.0,4,0.9282773802895208,0.9723251808582133,14,3.655925007192379e-06,,,0.0005785208378707449,,,AdamW,,fine_tuning,CosineAnnealingLR,,0.0027970462135908924,PRUNED
73,73,0.11538207530975342,2025-01-28 10:02:00.633713,2025-01-28 10:04:03.281584,0 days 00:02:02.647871,9.0,4,0.8941440505227222,0.949588028284168,13,6.647255568024815e-07,,,0.0007258978754847486,,,AdamW,,fine_tuning,CosineAnnealingLR,,0.0023948367807404853,PRUNED
74,74,0.6088012456893921,2025-01-28 10:04:03.298501,2025-01-28 10:07:06.493229,0 days 00:03:03.194728,7.0,5,0.8065739620497357,0.9538480943701715,15,2.537315734018042e-07,,,0.00034247124797166686,,,AdamW,,fine_tuning,CosineAnnealingLR,,0.004078522526957456,PRUNED
75,75,0.5473005175590515,2025-01-28 10:07:06.510173,2025-01-28 10:09:09.973789,0 days 00:02:03.463616,,4,0.866963803828251,0.946973046418494,14,,,,0.0005045596516701696,0.0003283551305856944,,AdamW,,fine_tuning,OneCycleLR,,0.004843514218917103,PRUNED
76,76,0.1004137247800827,2025-01-28 10:09:09.988984,2025-01-28 10:11:12.054546,0 days 00:02:02.065562,13.0,5,0.9645669502492722,0.9802851551373624,16,1.6431782253350203e-06,,,0.0002891378175896445,,,AdamW,,random,CosineAnnealingLR,,0.002127960139713265,PRUNED
77,77,0.5610786080360413,2025-01-28 10:11:12.071388,2025-01-28 10:13:12.546199,0 days 00:02:00.474811,,6,0.9497525313766592,0.9596040475977965,19,,,,0.00015734121094938735,0.004247003298689184,,AdamW,,fine_tuning,OneCycleLR,,0.005494581323817764,PRUNED
78,78,0.6940507888793945,2025-01-28 10:13:12.563278,2025-01-28 10:18:19.862647,0 days 00:05:07.299369,,4,0.8319670331595405,0.9388437796304719,15,,,,0.00024164076557907057,0.0004451568267609333,,AdamW,,fine_tuning,OneCycleLR,,0.0032722076696659794,COMPLETE
79,79,0.413273423910141,2025-01-28 10:18:19.889170,2025-01-28 10:20:19.835718,0 days 00:01:59.946548,,6,,,13,,,,0.005194359911499899,0.0015596064506024818,0.9600528533756753,SGD,,fine_tuning,OneCycleLR,,0.0009177836878610942,PRUNED
80,80,0.0,2025-01-28 10:20:19.852267,2025-01-28 10:21:24.636171,0 days 00:01:04.783904,,4,,,14,,,0.06444377876978383,0.0010629802760758406,,0.9864212226671478,RMSprop,,freezing,StepLR,4.0,0.10321636231861621,PRUNED
81,81,0.6648244261741638,2025-01-28 10:21:24.653058,2025-01-28 10:25:56.909388,0 days 00:04:32.256330,,8,0.9389400721434779,0.9483171182570641,14,,,,0.000389174439182967,0.0018298024344988633,,AdamW,,fine_tuning,OneCycleLR,,0.006090694928149239,COMPLETE
82,82,0.6841131448745728,2025-01-28 10:25:56.936792,2025-01-28 10:29:31.367159,0 days 00:03:34.430367,,8,0.9444116267941521,0.9662418340921622,11,,,,0.0004111162711531571,0.001993970701312389,,AdamW,,fine_tuning,OneCycleLR,,0.007166800325055627,COMPLETE
83,83,0.6625931859016418,2025-01-28 10:29:31.393267,2025-01-28 10:34:23.218554,0 days 00:04:51.825287,,8,0.9081339020638316,0.9570517141543723,15,,,,0.0005219630357714393,0.0028922766296743305,,AdamW,,fine_tuning,OneCycleLR,,0.0062156957468164,COMPLETE
84,84,0.6608455181121826,2025-01-28 10:34:23.244538,2025-01-28 10:38:56.122438,0 days 00:04:32.877900,,8,0.9592720446048895,0.9539201790184176,14,,,,0.000765285013708744,0.0011854468931643905,,AdamW,,fine_tuning,OneCycleLR,,0.005269144455936496,COMPLETE
85,85,0.7040274739265442,2025-01-28 10:38:56.148247,2025-01-28 10:44:07.355689,0 days 00:05:11.207442,,8,0.9254728409429731,0.9935441614506724,16,,,,0.0001795448295115534,0.0015120044265240552,,AdamW,,fine_tuning,OneCycleLR,,0.006786955265679344,COMPLETE
