,number,value,datetime_start,datetime_complete,duration,params_T_max,params_batch_size,params_beta1,params_beta2,params_epochs,params_eta_min,params_factor,params_gamma,params_lr,params_max_lr,params_momentum,params_optimizer,params_patience,params_preweight_mode,params_scheduler,params_step_size,params_weight_decay,state
90,90,0.14878630638122559,2025-01-28 23:06:46.608107,2025-01-28 23:08:47.806119,0 days 00:02:01.198012,6.0,6,0.9703607821463355,0.9525068961748666,13,5.012879316298748e-07,,,0.00011594467283098917,,,Adam,,random,CosineAnnealingLR,,,PRUNED
91,91,0.5171846151351929,2025-01-28 23:08:47.823323,2025-01-28 23:10:52.891839,0 days 00:02:05.068516,,4,0.9520450864923264,0.9471687476469873,12,,,,0.00016366132395783707,0.0022531662041013686,,Adam,,fine_tuning,OneCycleLR,,,PRUNED
92,92,0.5839129686355591,2025-01-28 23:10:52.909030,2025-01-28 23:13:18.681118,0 days 00:02:25.772088,,4,0.9426962197025313,0.9411467235323164,12,,,,0.00012023557027796773,0.00040677800955336044,,Adam,,fine_tuning,OneCycleLR,,,PRUNED
93,93,0.4517577290534973,2025-01-28 23:13:18.695970,2025-01-28 23:15:23.779533,0 days 00:02:05.083563,,4,0.9062164099845889,0.9416839239723893,12,,,,0.00013927310167787687,0.00020748669566084138,,Adam,,fine_tuning,OneCycleLR,,,PRUNED
94,94,0.5896026492118835,2025-01-28 23:15:23.797112,2025-01-28 23:17:49.671476,0 days 00:02:25.874364,,4,0.9191129737452206,0.980832059419656,14,,,,0.00018056290388051348,0.000611316043413648,,Adam,,fine_tuning,OneCycleLR,,,PRUNED
95,95,0.6220846176147461,2025-01-28 23:17:49.688399,2025-01-28 23:21:38.388572,0 days 00:03:48.700173,,4,0.9469110219237796,0.905405339493881,11,,,,0.00015403278170894082,0.0008605824805302656,,Adam,,fine_tuning,OneCycleLR,,,COMPLETE
96,96,0.6404651999473572,2025-01-28 23:21:38.414643,2025-01-28 23:26:08.765156,0 days 00:04:30.350513,,4,0.9368192871127062,0.9368728233659523,13,,,,0.0007871639147808858,0.0011777793376869018,,Adam,,fine_tuning,OneCycleLR,,,COMPLETE
97,97,0.655511200428009,2025-01-28 23:26:08.791006,2025-01-28 23:31:40.495994,0 days 00:05:31.704988,,4,0.9295129793402905,0.9110097298193686,16,,,,0.00011362809765064526,0.0016127061159939774,,Adam,,fine_tuning,OneCycleLR,,,COMPLETE
98,98,0.09064889699220657,2025-01-28 23:31:40.522288,2025-01-28 23:32:56.592086,0 days 00:01:16.069798,,4,0.9258941220500687,0.9110260038929944,17,,0.21997695532479888,,0.00011164947177583507,,,Adam,2.0,freezing,ReduceLROnPlateau,,,PRUNED
99,99,0.5631299018859863,2025-01-28 23:32:56.609493,2025-01-28 23:35:17.963653,0 days 00:02:21.354160,5.0,6,0.9839856136574222,0.926030621273576,16,3.1153566418183536e-07,,,0.0001020019014795831,,,Adam,,fine_tuning,CosineAnnealingLR,,,PRUNED
