,number,value,datetime_start,datetime_complete,duration,params_T_max,params_batch_size,params_beta1,params_beta2,params_epochs,params_eta_min,params_factor,params_gamma,params_lr,params_max_lr,params_momentum,params_optimizer,params_patience,params_preweight_mode,params_scheduler,params_step_size,params_weight_decay,state
0,0,0.0,2025-01-28 18:22:57.281030,2025-01-28 18:24:36.385725,0 days 00:01:39.104695,8.0,7,0.9658118084445251,0.9318563294010559,17,8.307341815284441e-06,,,0.0009472961959721175,,,Adam,,fine_tuning,CosineAnnealingLR,,,PRUNED
1,1,0.11859556287527084,2025-01-28 18:24:36.403009,2025-01-28 18:28:58.148780,0 days 00:04:21.745771,,6,0.9169765854389738,0.9282853454922604,13,,,0.16714116943161034,0.0004904539339172869,,,Adam,,random,StepLR,5.0,,COMPLETE
2,2,0.0,2025-01-28 18:28:58.175913,2025-01-28 18:29:58.182913,0 days 00:01:00.007000,,8,,,17,,,0.17734318931932058,0.004241247429282568,,0.9492067843282642,RMSprop,,freezing,StepLR,5.0,0.1260926568334326,PRUNED
3,3,0.0,2025-01-28 18:29:58.199448,2025-01-28 18:30:58.729628,0 days 00:01:00.530180,,8,,,13,,,0.056083539958035666,0.04948808716982222,,0.9468789822431335,SGD,,freezing,StepLR,5.0,5.129973236412686e-05,PRUNED
4,4,0.5738024115562439,2025-01-28 18:30:58.745647,2025-01-28 18:36:42.181126,0 days 00:05:43.435479,,6,,,17,,,,0.02344308086614435,0.004548729885792942,0.9727457317944981,SGD,,fine_tuning,OneCycleLR,,4.760099310748672e-05,COMPLETE
5,5,0.0,2025-01-28 18:36:42.207480,2025-01-28 18:38:20.163656,0 days 00:01:37.956176,,7,,,17,,0.2973243346544745,,0.0012548593198908888,,0.9780810792026231,RMSprop,3.0,fine_tuning,ReduceLROnPlateau,,0.5380377852807633,PRUNED
6,6,0.0,2025-01-28 18:38:20.180967,2025-01-28 18:39:57.630364,0 days 00:01:37.449397,5.0,7,,,16,4.0935047202991817e-07,,,0.016998759580392438,,0.9201578015051693,SGD,,fine_tuning,CosineAnnealingLR,,1.0003658748852571e-05,PRUNED
7,7,0.0,2025-01-28 18:39:57.648196,2025-01-28 18:40:58.938503,0 days 00:01:01.290307,,6,,,17,,0.29754314502094625,,0.0035675054331891385,,0.9775188644231251,RMSprop,2.0,freezing,ReduceLROnPlateau,,0.10566344366433493,PRUNED
8,8,0.0,2025-01-28 18:40:58.955239,2025-01-28 18:42:37.681921,0 days 00:01:38.726682,,7,,,14,,0.13439332022060319,,0.0010523472087119428,,0.902710004059513,RMSprop,4.0,random,ReduceLROnPlateau,,0.11239553251294436,PRUNED
9,9,0.0,2025-01-28 18:42:37.698916,2025-01-28 18:43:39.694166,0 days 00:01:01.995250,12.0,7,,,18,8.368075421103245e-07,,,0.04198573470793485,,0.9163819443057865,SGD,,freezing,CosineAnnealingLR,,3.626824917046231e-05,PRUNED
10,10,0.5770933628082275,2025-01-28 18:43:39.710524,2025-01-28 18:50:35.086926,0 days 00:06:55.376402,,4,0.8384084637388263,0.9966465871541936,20,,,,0.00016363071798730853,0.005598622137471745,,AdamW,,fine_tuning,OneCycleLR,,0.002334540139946281,COMPLETE
11,11,0.5228487849235535,2025-01-28 18:50:35.113117,2025-01-28 18:57:31.645318,0 days 00:06:56.532201,,4,0.8073762627164024,0.9982384196518811,20,,,,0.00010718292567854523,0.0061326515808014966,,AdamW,,fine_tuning,OneCycleLR,,0.002655109109652821,COMPLETE
12,12,0.5597598552703857,2025-01-28 18:57:31.676809,2025-01-28 19:04:26.215465,0 days 00:06:54.538656,,4,0.8208343757368655,0.9971972742795927,20,,,,0.00011305690440034182,0.004816011775762198,,AdamW,,fine_tuning,OneCycleLR,,0.002993592026470708,COMPLETE
13,13,0.6246349811553955,2025-01-28 19:04:26.241428,2025-01-28 19:08:13.133994,0 days 00:03:46.892566,,5,0.8708261470678579,0.967887834497986,11,,,,0.0002740105422449879,0.0010822108195364165,,AdamW,,fine_tuning,OneCycleLR,,0.0019180532723778714,COMPLETE
14,14,0.6072127819061279,2025-01-28 19:08:13.160321,2025-01-28 19:11:39.907624,0 days 00:03:26.747303,,5,0.8659668248281064,0.9663202278259342,10,,,,0.00023634709156398107,0.00034147963474949114,,AdamW,,fine_tuning,OneCycleLR,,0.001980178169327243,COMPLETE
15,15,0.5743816494941711,2025-01-28 19:11:39.934191,2025-01-28 19:15:07.001423,0 days 00:03:27.067232,,5,0.8852791432446278,0.9597089208928751,10,,,,0.0002872244044876639,0.0002664511392976781,,AdamW,,fine_tuning,OneCycleLR,,0.0019235251568125399,COMPLETE
16,16,0.33424806594848633,2025-01-28 19:15:07.019684,2025-01-28 19:17:10.695335,0 days 00:02:03.675651,,5,0.8788319017482499,0.9661262758482405,10,,,,0.0002911460826216607,0.0005304461751662484,,AdamW,,random,OneCycleLR,,0.0015865211734172892,PRUNED
17,17,0.4552774727344513,2025-01-28 19:17:10.713194,2025-01-28 19:19:34.773008,0 days 00:02:24.059814,,5,0.8624189285954047,0.9728148155450763,11,,,,0.0003829370577034805,0.00011206340683480459,,AdamW,,fine_tuning,OneCycleLR,,0.0014373509023124869,PRUNED
18,18,0.6150380373001099,2025-01-28 19:19:34.790873,2025-01-28 19:23:41.375236,0 days 00:04:06.584363,,5,0.9249167632760815,0.942817777641537,12,,,,0.00018996451627445853,0.0014141686589203273,,AdamW,,fine_tuning,OneCycleLR,,0.004040237093798783,COMPLETE
19,19,0.30199986696243286,2025-01-28 19:23:41.401544,2025-01-28 19:25:44.934981,0 days 00:02:03.533437,,5,0.929579252952361,0.9095029793511832,12,,,,0.0005470601837853499,0.0012910751140018746,,AdamW,,random,OneCycleLR,,0.004086624039409767,PRUNED
20,20,0.6538890600204468,2025-01-28 19:25:44.953463,2025-01-28 19:29:54.016519,0 days 00:04:09.063056,,4,0.9657598220274699,0.9415381964120528,12,,,,0.000178135361195772,0.0016728580201635886,,Adam,,fine_tuning,OneCycleLR,,,COMPLETE
21,21,0.6389976739883423,2025-01-28 19:29:54.042876,2025-01-28 19:34:03.583157,0 days 00:04:09.540281,,4,0.994487412785027,0.9453408486944055,12,,,,0.00017573113320428562,0.0015364326503002135,,Adam,,fine_tuning,OneCycleLR,,,COMPLETE
22,22,0.656636655330658,2025-01-28 19:34:03.609097,2025-01-28 19:38:13.962178,0 days 00:04:10.353081,,4,0.9942290457510327,0.9470973358718121,12,,,,0.00015914518209474802,0.0019041522721733853,,Adam,,fine_tuning,OneCycleLR,,,COMPLETE
23,23,0.5244317054748535,2025-01-28 19:38:13.988016,2025-01-28 19:40:40.433410,0 days 00:02:26.445394,,4,0.9985472475690118,0.9479546096952178,14,,,,0.00014487256524409745,0.002404304929598229,,Adam,,fine_tuning,OneCycleLR,,,PRUNED
24,24,0.620378851890564,2025-01-28 19:40:40.451456,2025-01-28 19:44:49.777880,0 days 00:04:09.326424,,4,0.9965896269806003,0.93334070821357,12,,,,0.0007359717372789835,0.00233088319787606,,Adam,,fine_tuning,OneCycleLR,,,COMPLETE
25,25,0.6669365763664246,2025-01-28 19:44:49.805280,2025-01-28 19:49:40.428958,0 days 00:04:50.623678,,4,0.9634396789345582,0.9177747811929413,14,,,,0.00017706784246894727,0.0018099558447350662,,Adam,,fine_tuning,OneCycleLR,,,COMPLETE
26,26,0.6347159147262573,2025-01-28 19:49:40.454562,2025-01-28 19:54:52.511215,0 days 00:05:12.056653,15.0,4,0.9586370067214258,0.9080864729338101,15,1.0048545816054478e-07,,,0.0001032788323559538,,,Adam,,fine_tuning,CosineAnnealingLR,,,COMPLETE
27,27,0.0,2025-01-28 19:54:52.537715,2025-01-28 19:56:35.433997,0 days 00:01:42.896282,,4,0.9636280238987059,0.9197166109468428,14,,0.4856273809482435,,0.0004067291734083761,,,Adam,5.0,fine_tuning,ReduceLROnPlateau,,,PRUNED
28,28,0.0,2025-01-28 19:56:35.451503,2025-01-28 19:58:17.320904,0 days 00:01:41.869401,,4,0.9444503053599029,0.91696977949497,13,,,0.4830568408911212,0.0017727614182540198,,,Adam,,random,StepLR,2.0,,PRUNED
29,29,0.0,2025-01-28 19:58:17.337644,2025-01-28 19:59:32.305266,0 days 00:01:14.967622,10.0,5,0.9768190046338633,0.9552522527653944,15,8.004458550675582e-06,,,0.00021149941376267639,,,Adam,,freezing,CosineAnnealingLR,,,PRUNED
30,30,0.6076364517211914,2025-01-28 19:59:32.321464,2025-01-28 20:03:20.850086,0 days 00:03:48.528622,,4,0.9421262660417676,0.9007417485098043,11,,,,0.000670869709078113,0.002634214546813028,,Adam,,fine_tuning,OneCycleLR,,,COMPLETE
31,31,0.615425169467926,2025-01-28 20:03:20.876923,2025-01-28 20:07:31.057917,0 days 00:04:10.180994,,4,0.9826837985153315,0.9415602836360987,12,,,,0.0001499989425647826,0.0007339868927428182,,Adam,,fine_tuning,OneCycleLR,,,COMPLETE
32,32,0.6202376484870911,2025-01-28 20:07:31.084581,2025-01-28 20:12:01.354025,0 days 00:04:30.269444,,4,0.9833091046580047,0.9386387228763634,13,,,,0.00036282008444657676,0.0016742782211364683,,Adam,,fine_tuning,OneCycleLR,,,COMPLETE
33,33,0.6063445806503296,2025-01-28 20:12:01.379552,2025-01-28 20:16:51.890147,0 days 00:04:50.510595,,4,0.9530862029154259,0.9516141045206759,14,,,,0.00013807838658317178,0.0030532970792620335,,Adam,,fine_tuning,OneCycleLR,,,COMPLETE
34,34,0.03677510470151901,2025-01-28 20:16:51.916924,2025-01-28 20:18:55.188778,0 days 00:02:03.271854,,5,0.9772713150870985,0.9238962158011028,11,,,0.4573620867447508,0.00017757495775458815,,,Adam,,fine_tuning,StepLR,2.0,,PRUNED
35,35,0.6640826463699341,2025-01-28 20:18:55.205714,2025-01-28 20:23:25.554366,0 days 00:04:30.348652,,4,0.9944057401668102,0.9794053369162471,13,,,,0.00022566113861826538,0.0008359838324083379,,Adam,,fine_tuning,OneCycleLR,,,COMPLETE
36,36,0.09663666039705276,2025-01-28 20:23:25.580367,2025-01-28 20:24:39.532549,0 days 00:01:13.952182,,6,0.9017993884478663,0.9834227422128011,13,,,0.3494149623457009,0.00022073694072710545,,,Adam,,freezing,StepLR,3.0,,PRUNED
37,37,0.6322856545448303,2025-01-28 20:24:39.549042,2025-01-28 20:29:09.258799,0 days 00:04:29.709757,,4,0.9702784527438311,0.9830596627916337,13,,,,0.00012712154619380243,0.0008049602976660236,,Adam,,fine_tuning,OneCycleLR,,,COMPLETE
38,38,0.0,2025-01-28 20:29:09.284663,2025-01-28 20:30:45.232819,0 days 00:01:35.948156,,8,0.9859641160669016,0.9348753942840966,13,,0.4972220355606433,,0.0004956446524903348,,,Adam,2.0,random,ReduceLROnPlateau,,,PRUNED
39,39,0.0,2025-01-28 20:30:45.249956,2025-01-28 20:32:26.543586,0 days 00:01:41.293630,,6,,,15,,,,0.001132395627082622,0.0006382601736749378,0.9314088283485333,RMSprop,,fine_tuning,OneCycleLR,,0.8903520271459014,PRUNED
40,40,0.0,2025-01-28 20:32:26.559480,2025-01-28 20:33:27.984321,0 days 00:01:01.424841,15.0,6,,,16,2.556793252212624e-06,,,0.005464364619267437,,0.9617661447718898,SGD,,freezing,CosineAnnealingLR,,0.0001994530114498658,PRUNED
41,41,0.6098232865333557,2025-01-28 20:33:28.001197,2025-01-28 20:37:37.010905,0 days 00:04:09.009708,,4,0.9969333097390415,0.9458527255363263,12,,,,0.00018005266873354477,0.001837144042994184,,Adam,,fine_tuning,OneCycleLR,,,COMPLETE
42,42,0.6255959272384644,2025-01-28 20:37:37.036847,2025-01-28 20:41:46.546769,0 days 00:04:09.509922,,4,0.967563684840802,0.9543128006572852,12,,,,0.00032115184081196057,0.001007322026722196,,Adam,,fine_tuning,OneCycleLR,,,COMPLETE
43,43,0.43791115283966064,2025-01-28 20:41:46.572805,2025-01-28 20:43:51.689975,0 days 00:02:05.117170,,4,0.9878197705324147,0.928396680325708,14,,,,0.00024031098461659646,0.003553699891463062,,Adam,,fine_tuning,OneCycleLR,,,PRUNED
44,44,0.6221694946289062,2025-01-28 20:43:51.704993,2025-01-28 20:47:40.540174,0 days 00:03:48.835181,,4,0.9514906297218053,0.960300361095855,11,,,,0.00016505227418151772,0.001866613738607388,,Adam,,fine_tuning,OneCycleLR,,,COMPLETE
45,45,0.0,2025-01-28 20:47:40.566693,2025-01-28 20:49:23.788823,0 days 00:01:43.222130,,5,,,12,,,,0.0010682362624222935,0.0012817774702527387,0.9010251684916141,RMSprop,,fine_tuning,OneCycleLR,,0.32597478334152113,PRUNED
46,46,0.0,2025-01-28 20:49:23.803379,2025-01-28 20:51:05.175103,0 days 00:01:41.371724,,4,,,13,,0.10479118920717062,,0.005288591142688149,,0.9889513645359227,SGD,5.0,fine_tuning,ReduceLROnPlateau,,1.0646635850511832e-05,PRUNED
47,47,0.6094167232513428,2025-01-28 20:51:05.191956,2025-01-28 20:55:55.899690,0 days 00:04:50.707734,,4,0.9697173122848001,0.9379405793046511,14,,,0.31801696752454617,0.00012276199309866305,,,Adam,,fine_tuning,StepLR,4.0,,COMPLETE
48,48,0.058321546763181686,2025-01-28 20:55:55.925815,2025-01-28 20:57:11.491225,0 days 00:01:15.565410,,5,0.989779981875983,0.9771368359327092,16,,,,0.0023045292317855613,0.009898727590233677,,Adam,,freezing,OneCycleLR,,,PRUNED
49,49,0.5163629055023193,2025-01-28 20:57:11.507710,2025-01-28 20:59:28.339689,0 days 00:02:16.831979,,8,0.9347840377937333,0.9297447958941468,11,,,,0.00025621696787348093,0.00046747378871020775,,Adam,,fine_tuning,OneCycleLR,,,PRUNED
50,50,0.14250175654888153,2025-01-28 20:59:28.356863,2025-01-28 21:01:32.581540,0 days 00:02:04.224677,,4,,,19,,,,0.005200213208257925,0.0009281119802502521,0.9370047671630263,SGD,,random,OneCycleLR,,0.0002173123461923662,PRUNED
51,51,0.14329995214939117,2025-01-28 21:01:32.596217,2025-01-28 21:03:37.257107,0 days 00:02:04.660890,15.0,4,0.9616671795795471,0.909255133568009,15,1.1870883322527299e-07,,,0.00020173020369454065,,,Adam,,fine_tuning,CosineAnnealingLR,,,PRUNED
52,52,0.6219627261161804,2025-01-28 21:03:37.274330,2025-01-28 21:08:07.398382,0 days 00:04:30.124052,12.0,4,0.9571340661043028,0.9000484416904446,13,1.0050809634880612e-07,,,0.00010465545081127387,,,Adam,,fine_tuning,CosineAnnealingLR,,,COMPLETE
53,53,0.6477471590042114,2025-01-28 21:08:07.416491,2025-01-28 21:13:39.045367,0 days 00:05:31.628876,13.0,4,0.9126328753829949,0.9121629117728103,16,3.1793737380143923e-07,,,0.00010492575582391644,,,Adam,,fine_tuning,CosineAnnealingLR,,,COMPLETE
54,54,0.0,2025-01-28 21:13:39.071617,2025-01-28 21:15:23.307499,0 days 00:01:44.235882,12.0,4,,,17,3.3189903207762896e-07,,,0.0010489638596681676,,0.9603098873679734,RMSprop,,fine_tuning,CosineAnnealingLR,,0.9298642546053107,PRUNED
55,55,0.6638867259025574,2025-01-28 21:15:23.324986,2025-01-28 21:20:51.784087,0 days 00:05:28.459101,9.0,5,0.9111634369772167,0.9162386997235443,16,1.9278495991280634e-06,,,0.00013107620863976564,,,Adam,,fine_tuning,CosineAnnealingLR,,,COMPLETE
56,56,0.6107025742530823,2025-01-28 21:20:51.810932,2025-01-28 21:26:20.603651,0 days 00:05:28.792719,9.0,5,0.9125174377350218,0.914031744020152,16,1.959753179993639e-06,,,0.00012855907844090773,,,Adam,,fine_tuning,CosineAnnealingLR,,,COMPLETE
57,57,0.607025146484375,2025-01-28 21:26:20.629813,2025-01-28 21:32:30.650252,0 days 00:06:10.020439,7.0,5,0.9140014297312073,0.9211340490335819,18,6.93897200007316e-07,,,0.00015589442864678705,,,Adam,,fine_tuning,CosineAnnealingLR,,,COMPLETE
58,58,0.6133225560188293,2025-01-28 21:32:30.682492,2025-01-28 21:38:40.442128,0 days 00:06:09.759636,11.0,5,0.8915120288187877,0.9131823799842615,18,2.4491549796550445e-06,,,0.00013612520265990398,,,Adam,,fine_tuning,CosineAnnealingLR,,,COMPLETE
59,59,0.45000603795051575,2025-01-28 21:38:40.468469,2025-01-28 21:40:45.188295,0 days 00:02:04.719826,13.0,4,0.8460323518690804,0.9261876483994458,16,2.60019226386084e-07,,,0.00032570051558951726,,,Adam,,fine_tuning,CosineAnnealingLR,,,PRUNED
60,60,0.4502130448818207,2025-01-28 21:40:45.206152,2025-01-28 21:42:48.689444,0 days 00:02:03.483292,6.0,5,0.9052103458028157,0.9067994997513267,15,1.4305539934373837e-06,,,0.0001035426089894685,,,Adam,,random,CosineAnnealingLR,,,PRUNED
61,61,0.6335756182670593,2025-01-28 21:42:48.706989,2025-01-28 21:48:41.489435,0 days 00:05:52.782446,,4,0.9228941684541507,0.9474168757909908,17,,,,0.00018892576763654368,0.0019515158624489016,,Adam,,fine_tuning,OneCycleLR,,,COMPLETE
62,62,0.6387182474136353,2025-01-28 21:48:41.515818,2025-01-28 21:52:50.771334,0 days 00:04:09.255516,,4,0.9927661636330338,0.9584681617281124,12,,,,0.00021810053261395532,0.0013376581076827768,,Adam,,fine_tuning,OneCycleLR,,,COMPLETE
63,63,0.31616392731666565,2025-01-28 21:52:50.790169,2025-01-28 21:54:55.747966,0 days 00:02:04.957797,,4,0.976223319450826,0.9908727101301757,14,,0.38341069715638915,,0.00015556069747538223,,,Adam,3.0,fine_tuning,ReduceLROnPlateau,,,PRUNED
64,64,0.6452711224555969,2025-01-28 21:54:55.768377,2025-01-28 21:59:04.946643,0 days 00:04:09.178266,,4,0.9441683395971945,0.9425417908732278,12,,,,0.00012164759289433437,0.0016049697945508738,,Adam,,fine_tuning,OneCycleLR,,,COMPLETE
65,65,0.6393327713012695,2025-01-28 21:59:04.973156,2025-01-28 22:02:32.661609,0 days 00:03:27.688453,9.0,4,0.940265955700866,0.9640650201339005,10,3.7018881080883813e-06,,,0.00011434289329499881,,,Adam,,fine_tuning,CosineAnnealingLR,,,COMPLETE
66,66,0.5226446986198425,2025-01-28 22:02:32.687423,2025-01-28 22:04:36.693443,0 days 00:02:04.006020,,4,,,16,,,,0.0051164930171627284,0.0033240351744169613,0.924752936653487,SGD,,fine_tuning,OneCycleLR,,2.021548078756609e-05,PRUNED
67,67,0.0,2025-01-28 22:04:36.712572,2025-01-28 22:05:52.302286,0 days 00:01:15.589714,,5,,,11,,,,0.0010345747227099586,0.004251237536717396,0.9605145636317193,RMSprop,,freezing,OneCycleLR,,0.7126370847050191,PRUNED
68,68,0.6189674139022827,2025-01-28 22:05:52.318873,2025-01-28 22:10:32.951901,0 days 00:04:40.633028,,7,0.892581922327838,0.9162230871621309,14,,,0.07230730372060953,0.00012382975111617387,,,Adam,,fine_tuning,StepLR,3.0,,COMPLETE
69,69,0.6120795607566833,2025-01-28 22:10:32.979105,2025-01-28 22:14:41.812456,0 days 00:04:08.833351,,4,0.9320783730351316,0.9331888786186565,12,,,,0.00027746463791331803,0.0010934215222509422,,Adam,,fine_tuning,OneCycleLR,,,COMPLETE
70,70,0.5481606721878052,2025-01-28 22:14:41.838818,2025-01-28 22:16:47.539390,0 days 00:02:05.700572,13.0,4,0.946783670409394,0.9227428878709206,13,2.078642265713286e-07,,,0.00014969709980512682,,,Adam,,fine_tuning,CosineAnnealingLR,,,PRUNED
71,71,0.636060357093811,2025-01-28 22:16:47.556502,2025-01-28 22:20:16.016796,0 days 00:03:28.460294,9.0,4,0.9214310015512668,0.9699054701599575,10,4.5689133335868816e-06,,,0.00011267903115596062,,,Adam,,fine_tuning,CosineAnnealingLR,,,COMPLETE
72,72,0.6489781141281128,2025-01-28 22:20:16.043231,2025-01-28 22:23:44.070530,0 days 00:03:28.027299,10.0,4,0.937696902799895,0.9651163671292101,10,3.7445936776335586e-06,,,0.00012033697999017708,,,Adam,,fine_tuning,CosineAnnealingLR,,,COMPLETE
73,73,0.6131212711334229,2025-01-28 22:23:44.096835,2025-01-28 22:27:32.800914,0 days 00:03:48.704079,10.0,4,0.9367936993846634,0.9761593427933531,11,1.237739301839092e-06,,,0.0001016464637835394,,,Adam,,fine_tuning,CosineAnnealingLR,,,COMPLETE
74,74,0.6453628540039062,2025-01-28 22:27:32.827047,2025-01-28 22:31:00.526687,0 days 00:03:27.699640,8.0,4,0.9541827800437119,0.9508600307328393,10,5.382752113918046e-07,,,0.00013745471751560755,,,Adam,,fine_tuning,CosineAnnealingLR,,,COMPLETE
75,75,0.540543258190155,2025-01-28 22:31:00.552794,2025-01-28 22:33:26.470626,0 days 00:02:25.917832,8.0,4,0.9506159073512717,0.9628927640049436,10,6.316714710769407e-07,,,0.00016918282045624811,,,AdamW,,fine_tuning,CosineAnnealingLR,,0.005553257229683843,PRUNED
76,76,0.6540245413780212,2025-01-28 22:33:26.487839,2025-01-28 22:36:54.003865,0 days 00:03:27.516026,7.0,4,0.8058439189224573,0.9501070192427428,10,5.048448102402947e-07,,,0.00019791105995851441,,,Adam,,fine_tuning,CosineAnnealingLR,,,COMPLETE
77,77,0.25861385464668274,2025-01-28 22:36:54.029975,2025-01-28 22:38:54.293642,0 days 00:02:00.263667,7.0,7,0.8221913126657093,0.903807086011517,15,4.7223226019008625e-06,,,0.000205268784898033,,,Adam,,random,CosineAnnealingLR,,,PRUNED
78,78,0.05572843179106712,2025-01-28 22:38:54.310753,2025-01-28 22:40:57.832541,0 days 00:02:03.521788,11.0,5,0.8793780894819908,0.9921550241698686,10,1.727708663620709e-07,,,0.00043036042582871514,,,Adam,,fine_tuning,CosineAnnealingLR,,,PRUNED
79,79,0.1188560202717781,2025-01-28 22:40:57.849838,2025-01-28 22:42:14.256932,0 days 00:01:16.407094,10.0,4,0.9108487768634087,0.9549767211166806,11,3.827427613628845e-07,,,0.00024505762920967906,,,Adam,,freezing,CosineAnnealingLR,,,PRUNED
80,80,0.2832411825656891,2025-01-28 22:42:14.274046,2025-01-28 22:44:19.161172,0 days 00:02:04.887126,7.0,4,0.8097621513122579,0.918744555312274,17,1.1220302398834064e-06,,,0.0003243668706114975,,,Adam,,fine_tuning,CosineAnnealingLR,,,PRUNED
81,81,0.5856877565383911,2025-01-28 22:44:19.178744,2025-01-28 22:46:44.682071,0 days 00:02:25.503327,8.0,4,0.9270810542419968,0.950973820497967,10,5.431218008636179e-07,,,0.0001396106425920287,,,Adam,,fine_tuning,CosineAnnealingLR,,,PRUNED
82,82,0.1198972836136818,2025-01-28 22:46:44.700295,2025-01-28 22:48:49.485023,0 days 00:02:04.784728,6.0,4,0.9748065654415753,0.9701042292994443,10,4.5493228187057737e-07,,,0.00018720356671217024,,,Adam,,fine_tuning,CosineAnnealingLR,,,PRUNED
83,83,0.6192402839660645,2025-01-28 22:48:49.502388,2025-01-28 22:52:38.032000,0 days 00:03:48.529612,9.0,4,0.8543339510221555,0.9499228767937824,11,1.7195537960673333e-06,,,0.00014471639658985484,,,Adam,,fine_tuning,CosineAnnealingLR,,,COMPLETE
84,84,0.41729968786239624,2025-01-28 22:52:38.058472,2025-01-28 22:54:42.752296,0 days 00:02:04.693824,8.0,4,0.9625645561291466,0.9380801515771223,10,2.753088932162642e-07,,,0.00016918412257427084,,,Adam,,fine_tuning,CosineAnnealingLR,,,PRUNED
85,85,0.46999359130859375,2025-01-28 22:54:42.770653,2025-01-28 22:56:47.439744,0 days 00:02:04.669091,,4,0.9578893434607512,0.9567868927965845,10,,0.19390853520814233,,0.00023507484287070722,,,Adam,4.0,fine_tuning,ReduceLROnPlateau,,,PRUNED
86,86,0.0,2025-01-28 22:56:47.457147,2025-01-28 22:58:28.673293,0 days 00:01:41.216146,7.0,4,,,15,3.074221320624593e-06,,,0.005086730348768074,,0.9078114731071258,SGD,,fine_tuning,CosineAnnealingLR,,0.0001285163410683086,PRUNED
87,87,0.6260284781455994,2025-01-28 22:58:28.689831,2025-01-28 23:02:59.021942,0 days 00:04:30.332111,,4,0.8955332860213425,0.9126176059241131,13,,,0.224519696771042,0.00013027919313001555,,,AdamW,,fine_tuning,StepLR,4.0,0.0074449365096067735,COMPLETE
88,88,0.0,2025-01-28 23:02:59.049002,2025-01-28 23:04:42.003564,0 days 00:01:42.954562,11.0,5,,,16,7.476035033303956e-07,,,0.0010286035632446498,,0.937655237529925,RMSprop,,fine_tuning,CosineAnnealingLR,,0.30095471798278656,PRUNED
89,89,0.09609784185886383,2025-01-28 23:04:42.023117,2025-01-28 23:06:46.590849,0 days 00:02:04.567732,,4,0.9798082221902273,0.9443372736152498,11,,,,0.0002016850184128655,0.007407617439945357,,Adam,,fine_tuning,OneCycleLR,,,PRUNED
