,number,value,datetime_start,datetime_complete,duration,params_T_max,params_batch_size,params_beta1,params_beta2,params_epochs,params_eta_min,params_factor,params_gamma,params_lr,params_max_lr,params_momentum,params_optimizer,params_patience,params_preweight_mode,params_scheduler,params_step_size,params_weight_decay,state
87,87,0.0,2025-01-28 05:33:52.316780,2025-01-28 05:34:21.808362,0 days 00:00:29.491582,,5,,,13,,,,0.008907288444569809,0.0026833347633996012,0.9179102570178969,RMSprop,,fine_tuning,OneCycleLR,,0.29314270471437853,PRUNED
88,88,0.48547911643981934,2025-01-28 05:34:21.822998,2025-01-28 05:35:39.357262,0 days 00:01:17.534264,8.0,6,,,15,1.4623852594904455e-07,,,0.01084588676170663,,0.9247715077476062,SGD,,fine_tuning,CosineAnnealingLR,,0.00035576200608648665,COMPLETE
89,89,0.0,2025-01-28 05:35:39.375752,2025-01-28 05:36:09.152718,0 days 00:00:29.776966,8.0,5,0.8383537536084663,0.9791076114213597,14,1.917192403510272e-07,,,0.008913997430033288,,,Adam,,fine_tuning,CosineAnnealingLR,,,PRUNED
90,90,0.0,2025-01-28 05:36:09.169318,2025-01-28 05:36:36.951057,0 days 00:00:27.781739,9.0,6,0.8017027698211926,0.9723637347905312,13,1.5698591010816628e-07,,,0.007328594222528188,,,AdamW,,fine_tuning,CosineAnnealingLR,,0.0019267957374723252,PRUNED
91,91,0.4682949185371399,2025-01-28 05:36:36.967274,2025-01-28 05:37:54.010661,0 days 00:01:17.043387,8.0,6,,,15,1.384294394213226e-07,,,0.011034902608551708,,0.9322242012030159,SGD,,fine_tuning,CosineAnnealingLR,,0.0003639291285269229,COMPLETE
92,92,0.0,2025-01-28 05:37:54.028792,2025-01-28 05:38:18.453798,0 days 00:00:24.425006,8.0,6,,,15,1.1707059623942953e-07,,,0.016667901750458132,,0.9255924182559948,SGD,,fine_tuning,CosineAnnealingLR,,0.0007613568430627606,PRUNED
93,93,0.43603357672691345,2025-01-28 05:38:18.470336,2025-01-28 05:38:49.949902,0 days 00:00:31.479566,9.0,6,,,14,1.0312903895801671e-07,,,0.015067059049505262,,0.9116279843634452,SGD,,fine_tuning,CosineAnnealingLR,,1.5696191373175265e-05,PRUNED
94,94,0.4932273328304291,2025-01-28 05:38:49.966265,2025-01-28 05:39:52.230217,0 days 00:01:02.263952,8.0,6,,,12,2.05896599030451e-07,,,0.01458897012313281,,0.9245261959005249,SGD,,fine_tuning,CosineAnnealingLR,,0.00043434533769675564,COMPLETE
95,95,0.0,2025-01-28 05:39:52.248516,2025-01-28 05:40:15.981278,0 days 00:00:23.732762,7.0,7,,,12,2.1156149863482706e-07,,,0.019303940588737276,,0.9336595461159047,SGD,,fine_tuning,CosineAnnealingLR,,0.00043302754706024265,PRUNED
96,96,0.3121768832206726,2025-01-28 05:40:15.997596,2025-01-28 05:40:52.886717,0 days 00:00:36.889121,7.0,4,,,11,2.6884607476402915e-07,,,0.011459602256130389,,0.9255022164672138,SGD,,random,CosineAnnealingLR,,0.00013000661347872705,PRUNED
97,97,0.0,2025-01-28 05:40:52.903083,2025-01-28 05:41:23.572895,0 days 00:00:30.669812,,4,0.8670355901602054,0.9988349644109437,12,,0.20411744869551487,,0.008540210009482114,,,AdamW,5.0,fine_tuning,ReduceLROnPlateau,,0.0021235331423925395,PRUNED
98,98,0.4562903344631195,2025-01-28 05:41:23.589478,2025-01-28 05:41:54.683592,0 days 00:00:31.094114,9.0,7,,,12,1.872968575721265e-07,,,0.0051122908152762,,0.9428831100854242,SGD,,fine_tuning,CosineAnnealingLR,,0.00031020383957748186,PRUNED
99,99,0.0160897858440876,2025-01-28 05:41:54.700138,2025-01-28 05:42:25.107388,0 days 00:00:30.407250,8.0,4,0.851347346975298,0.9666384892587938,13,1.443817086056535e-07,,,0.009129016488781595,,,AdamW,,freezing,CosineAnnealingLR,,0.003958169773624073,PRUNED
