,number,value,datetime_start,datetime_complete,duration,params_T_max,params_batch_size,params_beta1,params_beta2,params_epochs,params_eta_min,params_factor,params_gamma,params_lr,params_max_lr,params_momentum,params_optimizer,params_patience,params_preweight_mode,params_scheduler,params_step_size,params_weight_decay,state
89,89,0.6350789070129395,2025-01-27 11:59:11.823829,2025-01-27 12:01:09.668452,0 days 00:01:57.844623,,6,,,16,,0.3410991894526297,,0.007118603859210003,,0.9178626653039424,SGD,5.0,fine_tuning,ReduceLROnPlateau,,9.797554433218226e-05,COMPLETE
90,90,0.6609429121017456,2025-01-27 12:01:09.694835,2025-01-27 12:03:36.060359,0 days 00:02:26.365524,,6,,,20,,0.4025212859891799,,0.00572992770745708,,0.9330462610686364,SGD,4.0,fine_tuning,ReduceLROnPlateau,,7.034301942159962e-05,COMPLETE
91,91,0.6765016913414001,2025-01-27 12:03:36.082612,2025-01-27 12:05:38.966597,0 days 00:02:02.883985,,6,,,17,,0.3997437126341112,,0.005562807003835387,,0.9328567236871179,SGD,4.0,fine_tuning,ReduceLROnPlateau,,7.349985786517183e-05,COMPLETE
92,92,0.6563452482223511,2025-01-27 12:05:38.989191,2025-01-27 12:07:56.144150,0 days 00:02:17.154959,,6,,,19,,0.40245863663669446,,0.005685674783076737,,0.9333486963895351,SGD,4.0,fine_tuning,ReduceLROnPlateau,,6.69149781074175e-05,COMPLETE
93,93,0.6463590264320374,2025-01-27 12:07:56.162940,2025-01-27 12:10:21.080350,0 days 00:02:24.917410,,6,,,20,,0.11069273181280995,,0.00555315085943573,,0.936479171763006,SGD,4.0,fine_tuning,ReduceLROnPlateau,,0.00011608083784674406,COMPLETE
94,94,0.6755973696708679,2025-01-27 12:10:21.099256,2025-01-27 12:12:46.968276,0 days 00:02:25.869020,,6,,,20,,0.358280899117323,,0.00666417948254378,,0.9403221023630343,SGD,4.0,fine_tuning,ReduceLROnPlateau,,8.558990097348532e-05,COMPLETE
95,95,0.5844051837921143,2025-01-27 12:12:46.999905,2025-01-27 12:13:32.624877,0 days 00:00:45.624972,,6,,,20,,0.35152261294784715,,0.006158547682883761,,0.9414765773381945,SGD,4.0,fine_tuning,ReduceLROnPlateau,,9.007998393948343e-05,PRUNED
96,96,0.0,2025-01-27 12:13:32.643384,2025-01-27 12:14:09.714072,0 days 00:00:37.070688,,6,0.9860675030339099,0.9048007410075942,20,,0.3675031975510368,,0.0047859212081606,,,AdamW,4.0,fine_tuning,ReduceLROnPlateau,,0.0011350392565222063,PRUNED
97,97,0.0,2025-01-27 12:14:09.729292,2025-01-27 12:14:50.045259,0 days 00:00:40.315967,,6,,,19,,,,0.006699518775908687,0.00036690688307547273,0.9451266262532401,SGD,,random,OneCycleLR,,5.584315253074052e-05,PRUNED
98,98,0.0,2025-01-27 12:14:50.060352,2025-01-27 12:15:22.620217,0 days 00:00:32.559865,,7,,,20,,0.45127023710501263,,0.004687203102927104,,0.9671096733017049,RMSprop,4.0,fine_tuning,ReduceLROnPlateau,,0.10475739525212582,PRUNED
99,99,0.5987769961357117,2025-01-27 12:15:22.637007,2025-01-27 12:17:26.514645,0 days 00:02:03.877638,,6,,,20,,,0.060361823081164584,0.00630655926496892,,0.9326420189370178,SGD,,fine_tuning,StepLR,4.0,7.328539168176898e-05,PRUNED
