,number,value,datetime_start,datetime_complete,duration,params_T_max,params_batch_size,params_beta1,params_beta2,params_epochs,params_eta_min,params_factor,params_gamma,params_lr,params_max_lr,params_momentum,params_optimizer,params_patience,params_preweight_mode,params_scheduler,params_step_size,params_weight_decay,state
88,88,0.0,2025-01-27 03:12:09.484123,2025-01-27 03:13:45.640742,0 days 00:01:36.156619,,5,0.849182717745721,0.9835371751975571,18,,,0.3150762031132476,0.004442434389274302,,,AdamW,,random,StepLR,2.0,0.0012589864597411873,PRUNED
89,89,0.6582354307174683,2025-01-27 03:13:45.656918,2025-01-27 03:15:59.673008,0 days 00:02:14.016090,,4,,,19,,,,0.013170544550615917,0.00292101337865915,0.9288754124401654,SGD,,fine_tuning,OneCycleLR,,5.1924401686419715e-05,PRUNED
90,90,4.380969039630145e-05,2025-01-27 03:15:59.689665,2025-01-27 03:18:10.910475,0 days 00:02:11.220810,,6,0.881158352717781,0.9948075476663061,19,,,0.12406391950000795,0.0030631708733917435,,,AdamW,,fine_tuning,StepLR,3.0,0.0011930403551757437,PRUNED
91,91,0.7710119485855103,2025-01-27 03:18:10.925494,2025-01-27 03:25:22.396081,0 days 00:07:11.470587,10.0,8,,,20,1.2432265314015707e-07,,,0.006443947904793142,,0.9404822049271342,SGD,,fine_tuning,CosineAnnealingLR,,0.0008751543894816887,COMPLETE
92,92,0.7272233963012695,2025-01-27 03:25:22.422492,2025-01-27 03:27:32.747928,0 days 00:02:10.325436,10.0,8,,,20,1.1909398806406852e-07,,,0.006509170726966691,,0.9381554088408464,SGD,,fine_tuning,CosineAnnealingLR,,0.0008597505870467249,PRUNED
93,93,0.7555853128433228,2025-01-27 03:27:32.763311,2025-01-27 03:34:44.564118,0 days 00:07:11.800807,11.0,8,,,20,1.4709381117549062e-07,,,0.00770338196183243,,0.9356395318792925,SGD,,fine_tuning,CosineAnnealingLR,,0.000884287709371646,COMPLETE
94,94,0.7675122022628784,2025-01-27 03:34:44.590871,2025-01-27 03:41:55.911299,0 days 00:07:11.320428,11.0,8,,,20,2.2855533115726147e-07,,,0.006323695867517265,,0.9418145039103158,SGD,,fine_tuning,CosineAnnealingLR,,0.0007285901575473036,COMPLETE
95,95,0.7674219012260437,2025-01-27 03:41:55.937836,2025-01-27 03:49:07.868384,0 days 00:07:11.930548,,8,,,20,,,0.31249953256465535,0.006768671850928437,,0.9412676388351461,SGD,,fine_tuning,StepLR,4.0,0.0007020377520384015,COMPLETE
96,96,0.7593243718147278,2025-01-27 03:49:07.895067,2025-01-27 03:56:18.684418,0 days 00:07:10.789351,,8,,,20,,,0.29942376994205294,0.006723232974431546,,0.9406343473175106,SGD,,fine_tuning,StepLR,4.0,0.0006999511253460367,COMPLETE
97,97,0.7503953576087952,2025-01-27 03:56:18.710803,2025-01-27 04:03:30.524221,0 days 00:07:11.813418,,8,,,20,,,0.2319931451610439,0.0060248693168161805,,0.9477083855014647,SGD,,fine_tuning,StepLR,4.0,0.0005317608819018756,COMPLETE
98,98,0.05433931574225426,2025-01-27 04:03:30.550973,2025-01-27 04:04:51.873291,0 days 00:01:21.322318,,8,,,20,,,0.3709773820399638,0.007021271865423039,,0.9515534121645597,SGD,,freezing,StepLR,4.0,0.0009105588440565274,PRUNED
99,99,0.7604290246963501,2025-01-27 04:04:51.890079,2025-01-27 04:11:43.457767,0 days 00:06:51.567688,,8,,,19,,,0.45834591442708134,0.008134233294081437,,0.935724072943393,SGD,,fine_tuning,StepLR,3.0,0.0007172613988531666,COMPLETE
