,number,value,datetime_start,datetime_complete,duration,params_T_max,params_batch_size,params_beta1,params_beta2,params_epochs,params_eta_min,params_factor,params_gamma,params_lr,params_max_lr,params_momentum,params_optimizer,params_patience,params_preweight_mode,params_scheduler,params_step_size,params_weight_decay,state
0,0,0.0,2025-01-26 22:25:51.032004,2025-01-26 22:27:41.789134,0 days 00:01:50.757130,8.0,7,0.9658118084445251,0.9318563294010559,17,8.307341815284441e-06,,,0.0009472961959721175,,,Adam,,fine_tuning,CosineAnnealingLR,,,PRUNED
1,1,0.5374061465263367,2025-01-26 22:27:41.806746,2025-01-26 22:32:30.064244,0 days 00:04:48.257498,,6,0.9169765854389738,0.9282853454922604,13,,,0.16714116943161034,0.0004904539339172869,,,Adam,,random,StepLR,5.0,,COMPLETE
2,2,0.0,2025-01-26 22:32:30.093198,2025-01-26 22:33:50.669687,0 days 00:01:20.576489,,8,,,17,,,0.17734318931932058,0.004241247429282568,,0.9492067843282642,RMSprop,,freezing,StepLR,5.0,0.1260926568334326,PRUNED
3,3,0.12720252573490143,2025-01-26 22:33:50.686437,2025-01-26 22:36:44.681276,0 days 00:02:53.994839,,8,,,13,,,0.056083539958035666,0.04948808716982222,,0.9468789822431335,SGD,,freezing,StepLR,5.0,5.129973236412686e-05,COMPLETE
4,4,0.6939024925231934,2025-01-26 22:36:44.707966,2025-01-26 22:42:59.305368,0 days 00:06:14.597402,,6,,,17,,,,0.02344308086614435,0.004548729885792942,0.9727457317944981,SGD,,fine_tuning,OneCycleLR,,4.760099310748672e-05,COMPLETE
5,5,0.0,2025-01-26 22:42:59.324368,2025-01-26 22:44:33.002129,0 days 00:01:33.677761,,7,,,17,,0.2973243346544745,,0.0012548593198908888,,0.9780810792026231,RMSprop,3.0,fine_tuning,ReduceLROnPlateau,,0.5380377852807633,PRUNED
6,6,0.7595766186714172,2025-01-26 22:44:33.018585,2025-01-26 22:50:27.431096,0 days 00:05:54.412511,5.0,7,,,16,4.0935047202991817e-07,,,0.016998759580392438,,0.9201578015051693,SGD,,fine_tuning,CosineAnnealingLR,,1.0003658748852571e-05,COMPLETE
7,7,0.015558699145913124,2025-01-26 22:50:27.457256,2025-01-26 22:54:16.446262,0 days 00:03:48.989006,,6,,,17,,0.29754314502094625,,0.0035675054331891385,,0.9775188644231251,RMSprop,2.0,freezing,ReduceLROnPlateau,,0.10566344366433493,COMPLETE
8,8,0.0,2025-01-26 22:54:16.472698,2025-01-26 22:55:50.124372,0 days 00:01:33.651674,,7,,,14,,0.13439332022060319,,0.0010523472087119428,,0.902710004059513,RMSprop,4.0,random,ReduceLROnPlateau,,0.11239553251294436,PRUNED
9,9,0.13372980058193207,2025-01-26 22:55:50.139851,2025-01-26 22:57:12.141768,0 days 00:01:22.001917,12.0,7,,,18,8.368075421103245e-07,,,0.04198573470793485,,0.9163819443057865,SGD,,freezing,CosineAnnealingLR,,3.626824917046231e-05,PRUNED
10,10,0.751297116279602,2025-01-26 22:57:12.157910,2025-01-26 23:04:42.360001,0 days 00:07:30.202091,5.0,4,0.8384084637388263,0.9966465871541936,20,1.2726349105392805e-07,,,0.0001727935630014265,,,AdamW,,fine_tuning,CosineAnnealingLR,,0.001305443110763528,COMPLETE
11,11,0.7660157084465027,2025-01-26 23:04:42.379093,2025-01-26 23:12:11.710435,0 days 00:07:29.331342,5.0,4,0.8132826859576652,0.9981630949532025,20,1.0373933550020707e-07,,,0.00011006134382628895,,,AdamW,,fine_tuning,CosineAnnealingLR,,0.001219332330568898,COMPLETE
12,12,0.7452496886253357,2025-01-26 23:12:11.737125,2025-01-26 23:15:57.222366,0 days 00:03:45.485241,5.0,4,0.8148764525087936,0.9988744806221446,10,1.271892954373582e-07,,,0.0001785101188525541,,,AdamW,,fine_tuning,CosineAnnealingLR,,0.0012591873389691888,COMPLETE
13,13,0.746829628944397,2025-01-26 23:15:57.249002,2025-01-26 23:23:23.627106,0 days 00:07:26.378104,8.0,5,0.8714127513110054,0.9640767898775007,20,5.119054802509489e-07,,,0.00010976812531628848,,,AdamW,,fine_tuning,CosineAnnealingLR,,0.0011847836434812024,COMPLETE
14,14,0.0,2025-01-26 23:23:23.654111,2025-01-26 23:25:14.970642,0 days 00:01:51.316531,,5,,,10,,,,0.017131484347707296,0.00010254561856137388,0.9251752004622653,SGD,,fine_tuning,OneCycleLR,,1.1831466490054087e-05,PRUNED
15,15,0.639336347579956,2025-01-26 23:25:14.986574,2025-01-26 23:27:30.088527,0 days 00:02:15.101953,15.0,5,0.8013610220197893,0.9649201050286638,15,2.831940902454824e-07,,,0.00034069812173473266,,,AdamW,,fine_tuning,CosineAnnealingLR,,0.0025655884291418333,PRUNED
16,16,0.0,2025-01-26 23:27:30.105161,2025-01-26 23:29:06.498671,0 days 00:01:36.393510,7.0,4,,,19,2.8985024542695094e-06,,,0.011429005556281204,,0.9285446680004956,SGD,,random,CosineAnnealingLR,,0.00020478219531192877,PRUNED
17,17,0.0,2025-01-26 23:29:06.513864,2025-01-26 23:30:55.460910,0 days 00:01:48.947046,11.0,5,0.9048626018885886,0.9082256257207966,12,2.721868856380974e-07,,,0.0024178983079523857,,,AdamW,,fine_tuning,CosineAnnealingLR,,0.0029254007372684944,PRUNED
18,18,0.6824058890342712,2025-01-26 23:30:55.477319,2025-01-26 23:33:31.646549,0 days 00:02:36.169230,,7,0.9683613329569909,0.973103363405973,15,,,,0.00047993046803821457,0.00028820919478023745,,Adam,,fine_tuning,OneCycleLR,,,PRUNED
19,19,0.0,2025-01-26 23:33:31.663319,2025-01-26 23:35:21.172252,0 days 00:01:49.508933,5.0,8,0.8661956870897728,0.9795504094990028,19,1.97755766191336e-06,,,0.0018926520102545957,,,AdamW,,random,CosineAnnealingLR,,0.004374896478117527,PRUNED
20,20,0.7478744387626648,2025-01-26 23:35:21.189095,2025-01-26 23:41:12.925041,0 days 00:05:51.735946,7.0,6,,,16,2.8075761711654535e-07,,,0.012107875192737816,,0.9036154357682028,SGD,,fine_tuning,CosineAnnealingLR,,1.0308843653640133e-05,COMPLETE
21,21,0.7791067957878113,2025-01-26 23:41:12.953612,2025-01-26 23:48:40.506054,0 days 00:07:27.552442,5.0,4,0.8371696587588211,0.9987775873854282,20,1.060835754932426e-07,,,0.00010158667655101443,,,AdamW,,fine_tuning,CosineAnnealingLR,,0.0019419825410363493,COMPLETE
22,22,0.7472524642944336,2025-01-26 23:48:40.532282,2025-01-26 23:55:46.300542,0 days 00:07:05.768260,6.0,4,0.8409018157299676,0.9861362698323977,19,1.0672186222066504e-07,,,0.000121859450863752,,,AdamW,,fine_tuning,CosineAnnealingLR,,0.0021779807858909616,COMPLETE
23,23,0.6498985886573792,2025-01-26 23:55:46.326822,2025-01-26 23:58:02.145025,0 days 00:02:15.818203,9.0,4,0.8385533199556532,0.9465707722872423,20,1.9656651548357093e-07,,,0.00022912531108645052,,,AdamW,,fine_tuning,CosineAnnealingLR,,0.0019382230958670343,PRUNED
24,24,0.7033330202102661,2025-01-26 23:58:02.162113,2025-01-27 00:00:17.023164,0 days 00:02:14.861051,6.0,5,0.8716068312846099,0.9870250581635656,18,5.879248196870493e-07,,,0.00027268763239096075,,,AdamW,,fine_tuning,CosineAnnealingLR,,0.003577638085317036,PRUNED
25,25,0.7627602815628052,2025-01-27 00:00:17.040162,2025-01-27 00:07:01.114333,0 days 00:06:44.074171,5.0,4,0.9358324430277309,0.9542306452784934,18,1.6475626665177984e-07,,,0.00010048545816054493,,,AdamW,,fine_tuning,CosineAnnealingLR,,0.0016427352546238216,COMPLETE
26,26,0.7414030432701111,2025-01-27 00:07:01.144739,2025-01-27 00:14:09.013787,0 days 00:07:07.869048,,4,0.9293591218093961,0.9524736370996945,19,,,0.47327982481120223,0.00010547467915413987,,,AdamW,,fine_tuning,StepLR,2.0,0.0016999281803879989,COMPLETE
27,27,0.48894500732421875,2025-01-27 00:14:09.040562,2025-01-27 00:16:25.459427,0 days 00:02:16.418865,,4,0.9369035711291267,0.9988939590887985,20,,,,0.00015680199016994097,0.009774061413997333,,AdamW,,fine_tuning,OneCycleLR,,0.0015607342830557933,PRUNED
28,28,0.4210807979106903,2025-01-27 00:16:25.476219,2025-01-27 00:18:41.438871,0 days 00:02:15.962652,,5,0.8218158233113732,0.9035697414501633,18,,0.4953512352053361,,0.00039434561717806115,,,AdamW,5.0,random,ReduceLROnPlateau,,0.0015029666396395131,PRUNED
29,29,0.0689324289560318,2025-01-27 00:18:41.453994,2025-01-27 00:20:04.634080,0 days 00:01:23.180086,7.0,4,0.9932975977987532,0.9869453426823368,19,1.0369237059391076e-07,,,0.0007644143762266379,,,Adam,,freezing,CosineAnnealingLR,,,PRUNED
30,30,0.6758770942687988,2025-01-27 00:20:04.650758,2025-01-27 00:22:20.029768,0 days 00:02:15.379010,13.0,5,0.891221924695758,0.9195539758896547,18,1.8542671360261172e-07,,,0.00023390253119389835,,,AdamW,,fine_tuning,CosineAnnealingLR,,0.002168896242733286,PRUNED
31,31,0.0,2025-01-27 00:22:20.046971,2025-01-27 00:23:55.353298,0 days 00:01:35.306327,5.0,4,,,16,1.8991205596897687e-07,,,0.019791877716872942,,0.9589062818459135,SGD,,fine_tuning,CosineAnnealingLR,,0.0006034262174762242,PRUNED
32,32,0.7210857272148132,2025-01-27 00:23:55.368782,2025-01-27 00:26:08.676997,0 days 00:02:13.308215,6.0,6,0.8013277377896815,0.9516731953985418,16,4.1767593165313215e-07,,,0.000152929561944005,,,Adam,,fine_tuning,CosineAnnealingLR,,,PRUNED
33,33,0.5163486003875732,2025-01-27 00:26:08.693882,2025-01-27 00:28:24.467827,0 days 00:02:15.773945,5.0,4,0.9489449583004198,0.9715314005045282,20,1.7133765769083684e-07,,,0.0005833949762137931,,,AdamW,,fine_tuning,CosineAnnealingLR,,0.004236396136296012,PRUNED
34,34,0.7686715126037598,2025-01-27 00:28:24.484704,2025-01-27 00:34:54.386673,0 days 00:06:29.901969,,8,,,18,,,0.4637111395771056,0.011300307781636315,,0.9347974524621644,SGD,,fine_tuning,StepLR,2.0,0.0006103701559661618,COMPLETE
35,35,0.7192580103874207,2025-01-27 00:34:54.412951,2025-01-27 00:37:05.513898,0 days 00:02:11.100947,,8,0.8583160321937796,0.960555817942151,18,,,0.496970471027094,0.00013445206219298128,,,Adam,,fine_tuning,StepLR,2.0,,PRUNED
36,36,0.0,2025-01-27 00:37:05.531072,2025-01-27 00:38:36.985289,0 days 00:01:31.454217,,8,,,19,,,0.3582051775521205,0.00551145200568696,,0.9367336021732005,RMSprop,,random,StepLR,3.0,0.1062825525610239,PRUNED
37,37,0.0462254136800766,2025-01-27 00:38:37.001811,2025-01-27 00:40:00.150402,0 days 00:01:23.148591,,5,0.8851764117232612,0.9399411833644862,20,,,0.358528098843075,0.000208478652263534,,,AdamW,,freezing,StepLR,3.0,0.0011394789187805891,PRUNED
38,38,0.744198203086853,2025-01-27 00:40:00.166824,2025-01-27 00:46:20.228494,0 days 00:06:20.061670,,4,,,17,,,0.3752273546299043,0.00833670002867782,,0.9614179404638827,SGD,,fine_tuning,StepLR,2.0,0.0006831632109338773,COMPLETE
39,39,0.0,2025-01-27 00:46:20.254886,2025-01-27 00:47:53.880224,0 days 00:01:33.625338,,6,,,18,,,0.2554751650681776,0.001661526922947108,,0.9375505501730189,RMSprop,,fine_tuning,StepLR,4.0,0.29795409419603347,PRUNED
40,40,0.02690095826983452,2025-01-27 00:47:53.899197,2025-01-27 00:49:16.099056,0 days 00:01:22.199859,,5,,,17,,0.4744317866788999,,0.030859464654100003,,0.9880873528005137,SGD,2.0,freezing,ReduceLROnPlateau,,0.0006651776565425252,PRUNED
41,41,0.0,2025-01-27 00:49:16.116308,2025-01-27 00:50:49.595062,0 days 00:01:33.478754,6.0,7,,,14,1.0299500711256872e-07,,,0.013165349959652097,,0.9152992614526568,SGD,,fine_tuning,CosineAnnealingLR,,0.00047959986201927046,PRUNED
42,42,0.0,2025-01-27 00:50:49.611196,2025-01-27 00:52:20.854666,0 days 00:01:31.243470,,8,,,16,,,0.4250392769946364,0.028613741044248187,,0.9162898256613199,SGD,,fine_tuning,StepLR,3.0,0.000784162888570741,PRUNED
43,43,0.7564623355865479,2025-01-27 00:52:20.871008,2025-01-27 00:58:35.323093,0 days 00:06:14.452085,6.0,7,,,17,3.474111487504285e-07,,,0.008814578282313378,,0.927612996776656,SGD,,fine_tuning,CosineAnnealingLR,,0.00032625089779057196,COMPLETE
44,44,0.0983099713921547,2025-01-27 00:58:35.349144,2025-01-27 01:00:45.791395,0 days 00:02:10.442251,,8,,,14,,,,0.015065836852794667,0.0011744486408234193,0.9379828877070298,SGD,,fine_tuning,OneCycleLR,,1.9244242774970877e-05,PRUNED
45,45,0.0,2025-01-27 01:00:45.808743,2025-01-27 01:02:20.460643,0 days 00:01:34.651900,,7,0.8223740998807232,0.9900902458309573,19,,0.11141999735469449,,0.0057431777624779,,,AdamW,5.0,fine_tuning,ReduceLROnPlateau,,0.005840607196010237,PRUNED
46,46,0.0,2025-01-27 01:02:20.479101,2025-01-27 01:03:53.936131,0 days 00:01:33.457030,8.0,6,,,20,1.746732138137409e-07,,,0.0031703894474673436,,0.911744370309864,RMSprop,,fine_tuning,CosineAnnealingLR,,0.18538377259770944,PRUNED
47,47,0.05320030450820923,2025-01-27 01:03:53.951468,2025-01-27 01:05:14.029433,0 days 00:01:20.077965,5.0,8,,,12,7.859459202313486e-07,,,0.021975273082083455,,0.954149536860482,SGD,,freezing,CosineAnnealingLR,,9.674785941720121e-05,PRUNED
48,48,0.0,2025-01-27 01:05:14.045654,2025-01-27 01:06:51.068262,0 days 00:01:37.022608,,4,0.8517196263973593,0.9765108052429096,18,,,0.2743264105978112,0.006698990318923614,,,AdamW,,fine_tuning,StepLR,4.0,0.006038280499762258,PRUNED
49,49,0.0,2025-01-27 01:06:51.086723,2025-01-27 01:08:23.948221,0 days 00:01:32.861498,7.0,7,,,17,1.5095668950050936e-07,,,0.04894131531435099,,0.9324069343481143,SGD,,random,CosineAnnealingLR,,0.0008056814534717563,PRUNED
50,50,0.733338475227356,2025-01-27 01:08:23.963182,2025-01-27 01:10:37.638883,0 days 00:02:13.675701,,7,0.8999484730884555,0.9819292280663033,15,,,,0.000135378559421927,0.0013023717683165867,,AdamW,,fine_tuning,OneCycleLR,,0.0026112119958435404,PRUNED
51,51,0.7459033727645874,2025-01-27 01:10:37.655361,2025-01-27 01:16:53.316734,0 days 00:06:15.661373,6.0,7,,,17,3.404070288531787e-07,,,0.009734951292067688,,0.9236311622962764,SGD,,fine_tuning,CosineAnnealingLR,,0.00038565675448602184,COMPLETE
52,52,0.0,2025-01-27 01:16:53.342655,2025-01-27 01:18:28.713333,0 days 00:01:35.370678,5.0,6,,,16,1.3682441879395806e-06,,,0.016073859318942292,,0.9226796388606151,SGD,,fine_tuning,CosineAnnealingLR,,0.0003091510736447823,PRUNED
53,53,0.7321786880493164,2025-01-27 01:18:28.729562,2025-01-27 01:20:41.824582,0 days 00:02:13.095020,6.0,7,,,15,2.347110163338751e-07,,,0.009268368587085902,,0.9436172011888969,SGD,,fine_tuning,CosineAnnealingLR,,0.00018481844993300985,PRUNED
54,54,0.7522371411323547,2025-01-27 01:20:41.841033,2025-01-27 01:26:50.671641,0 days 00:06:08.830608,5.0,8,,,17,3.788334978263843e-07,,,0.01877045932725653,,0.9073324956031774,SGD,,fine_tuning,CosineAnnealingLR,,0.0008199292449269235,COMPLETE
55,55,0.0,2025-01-27 01:26:50.697930,2025-01-27 01:28:26.092575,0 days 00:01:35.394645,6.0,4,,,18,5.630936562923742e-06,,,0.013208817838526248,,0.9328077070060004,SGD,,fine_tuning,CosineAnnealingLR,,0.0005074617576433331,PRUNED
56,56,0.0,2025-01-27 01:28:26.109537,2025-01-27 01:30:00.674457,0 days 00:01:34.564920,7.0,6,0.9538175694257945,0.9167937857492687,19,1.2790753269491862e-07,,,0.007158947286725475,,,AdamW,,fine_tuning,CosineAnnealingLR,,0.0017774015755774497,PRUNED
57,57,0.7590867877006531,2025-01-27 01:30:00.692883,2025-01-27 01:35:47.162860,0 days 00:05:46.469977,9.0,8,0.92219260341318,0.9584714819581972,16,6.627827086886638e-07,,,0.00010829182310962558,,,Adam,,fine_tuning,CosineAnnealingLR,,,COMPLETE
58,58,0.5746594667434692,2025-01-27 01:35:47.192532,2025-01-27 01:37:59.101364,0 days 00:02:11.908832,,8,0.9155890807470396,0.9577945238689001,13,,0.22682362394213357,,0.00010366325259499711,,,Adam,4.0,random,ReduceLROnPlateau,,,PRUNED
59,59,0.6797649264335632,2025-01-27 01:37:59.117958,2025-01-27 01:40:10.447875,0 days 00:02:11.329917,10.0,8,0.9770970855952912,0.939246602321531,20,1.013269193269647e-06,,,0.00018019946823713356,,,Adam,,fine_tuning,CosineAnnealingLR,,,PRUNED
60,60,0.6467326283454895,2025-01-27 01:40:10.465057,2025-01-27 01:42:21.962277,0 days 00:02:11.497220,9.0,8,0.9258263390310444,0.9689974876773708,16,7.080054739154689e-07,,,0.00029286340817609273,,,Adam,,fine_tuning,CosineAnnealingLR,,,PRUNED
61,61,0.7566514611244202,2025-01-27 01:42:21.979444,2025-01-27 01:48:16.902050,0 days 00:05:54.922606,5.0,7,0.9419339344045167,0.9434045009440508,16,4.925587102936804e-07,,,0.00011878023520856198,,,Adam,,fine_tuning,CosineAnnealingLR,,,COMPLETE
62,62,0.6590752601623535,2025-01-27 01:48:16.932317,2025-01-27 01:50:28.015134,0 days 00:02:11.082817,13.0,8,0.95671272996465,0.933429715127033,15,4.939937543803564e-07,,,0.00012193830175152718,,,Adam,,fine_tuning,CosineAnnealingLR,,,PRUNED
63,63,0.7312092781066895,2025-01-27 01:50:28.030111,2025-01-27 01:52:43.523904,0 days 00:02:15.493793,5.0,4,0.9400977795549474,0.948303830442333,16,9.337836232890004e-07,,,0.00010068436253611551,,,Adam,,fine_tuning,CosineAnnealingLR,,,PRUNED
64,64,0.7475717663764954,2025-01-27 01:52:43.541467,2025-01-27 01:57:54.501583,0 days 00:05:10.960116,5.0,7,0.9147178836091391,0.9396758401275261,14,5.859771866495887e-07,,,0.00012579322238557238,,,Adam,,fine_tuning,CosineAnnealingLR,,,COMPLETE
65,65,0.7430582642555237,2025-01-27 01:57:54.527999,2025-01-27 02:03:31.320195,0 days 00:05:36.792196,5.0,4,0.941029196448369,0.9911301092421243,15,1.46646464943768e-07,,,0.00015425463380653033,,,Adam,,fine_tuning,CosineAnnealingLR,,,COMPLETE
66,66,0.0,2025-01-27 02:03:31.350965,2025-01-27 02:04:39.442615,0 days 00:01:08.091650,,7,0.8133855370629538,0.9304463449653422,19,,,,0.00019515293481162828,0.00036136082051210067,,AdamW,,freezing,OneCycleLR,,0.002128839571937566,PRUNED
67,67,0.69638592004776,2025-01-27 02:04:39.458733,2025-01-27 02:06:54.606559,0 days 00:02:15.147826,12.0,4,0.9264911142467762,0.9938993116649978,16,2.2490087420667392e-07,,,0.0001169775524977055,,,Adam,,fine_tuning,CosineAnnealingLR,,,PRUNED
68,68,0.3362627327442169,2025-01-27 02:06:54.624016,2025-01-27 02:09:08.442103,0 days 00:02:13.818087,,6,0.9077480327034413,0.9444298234135406,20,,,0.41573065904670303,0.0008990658396431624,,,AdamW,,fine_tuning,StepLR,2.0,0.0025680375552857067,PRUNED
69,69,0.0,2025-01-27 02:09:08.458967,2025-01-27 02:10:40.154700,0 days 00:01:31.695733,8.0,8,,,18,1.305851305702926e-07,,,0.00103754343637229,,0.951152209877311,RMSprop,,fine_tuning,CosineAnnealingLR,,0.13632646115393426,PRUNED
70,70,0.26808980107307434,2025-01-27 02:10:40.169650,2025-01-27 02:12:55.902061,0 days 00:02:15.732411,15.0,5,0.9753373211592753,0.9238594419487594,19,1.2454915811490048e-06,,,0.0001529357967226288,,,AdamW,,random,CosineAnnealingLR,,0.006782320292189545,PRUNED
71,71,0.7808420658111572,2025-01-27 02:12:55.919433,2025-01-27 02:19:11.339471,0 days 00:06:15.420038,6.0,7,,,17,3.181777359507687e-07,,,0.005077286891014731,,0.9410626508845523,SGD,,fine_tuning,CosineAnnealingLR,,6.509385638898574e-05,COMPLETE
72,72,0.003991130739450455,2025-01-27 02:19:11.365936,2025-01-27 02:21:21.189051,0 days 00:02:09.823115,5.0,7,0.8291828361886402,0.9561607926993979,17,4.2707526755299374e-07,,,0.0037119074077924313,,,Adam,,fine_tuning,CosineAnnealingLR,,,PRUNED
73,73,0.1551629602909088,2025-01-27 02:21:21.205750,2025-01-27 02:23:34.806785,0 days 00:02:13.601035,6.0,7,0.888417331347471,0.934440399718021,16,2.720230348084013e-07,,,0.0013688245580111482,,,AdamW,,fine_tuning,CosineAnnealingLR,,0.003121308439826181,PRUNED
74,74,0.756700873374939,2025-01-27 02:23:34.823492,2025-01-27 02:29:20.747556,0 days 00:05:45.924064,5.0,8,,,16,6.574907128307418e-07,,,0.005070610129865038,,0.9410262088704026,SGD,,fine_tuning,CosineAnnealingLR,,8.368584345867155e-05,COMPLETE
75,75,0.7413244247436523,2025-01-27 02:29:20.773915,2025-01-27 02:31:31.746046,0 days 00:02:10.972131,,8,,,17,,,0.050420603666620156,0.010623038643404175,,0.9435324160097639,SGD,,fine_tuning,StepLR,4.0,7.512715505545867e-05,PRUNED
76,76,0.0,2025-01-27 02:31:31.762368,2025-01-27 02:33:02.948281,0 days 00:01:31.185913,7.0,8,,,17,6.746197319728491e-07,,,0.027054324340119573,,0.9456168691304079,SGD,,fine_tuning,CosineAnnealingLR,,4.173412221875516e-05,PRUNED
77,77,0.7640650868415833,2025-01-27 02:33:02.964597,2025-01-27 02:39:31.009778,0 days 00:06:28.045181,,8,,,18,,0.41244880264357797,,0.007820966359657485,,0.9401285903657844,SGD,3.0,fine_tuning,ReduceLROnPlateau,,2.640508462897979e-05,COMPLETE
78,78,0.08029456436634064,2025-01-27 02:39:31.037071,2025-01-27 02:40:51.876358,0 days 00:01:20.839287,,8,,,18,,0.40009867855867143,,0.014826479268053389,,0.9494729703301765,SGD,3.0,freezing,ReduceLROnPlateau,,2.0972887160874594e-05,PRUNED
79,79,0.6902428269386292,2025-01-27 02:40:51.893013,2025-01-27 02:43:06.012666,0 days 00:02:14.119653,,4,,,19,,0.3918204681412118,,0.005080731810949562,,0.93257855782618,SGD,3.0,fine_tuning,ReduceLROnPlateau,,2.097565570867816e-05,PRUNED
80,80,0.0,2025-01-27 02:43:06.029505,2025-01-27 02:44:54.604326,0 days 00:01:48.574821,,8,0.811029306064417,0.9662418340921622,18,,0.3931138727417255,,0.002124828273368561,,,AdamW,2.0,fine_tuning,ReduceLROnPlateau,,0.0014071411143165592,PRUNED
81,81,0.7195622324943542,2025-01-27 02:44:54.623075,2025-01-27 02:47:05.737232,0 days 00:02:11.114157,,8,,,18,,0.21508062986317697,,0.00793832421255662,,0.9416600414473731,SGD,4.0,fine_tuning,ReduceLROnPlateau,,6.582303013340907e-05,PRUNED
82,82,0.748963475227356,2025-01-27 02:47:05.753722,2025-01-27 02:53:14.954459,0 days 00:06:09.200737,6.0,8,,,17,3.095148607914319e-07,,,0.007394675806962521,,0.9649928615560392,SGD,,fine_tuning,CosineAnnealingLR,,2.7660231332242797e-05,COMPLETE
83,83,0.0,2025-01-27 02:53:14.980780,2025-01-27 02:54:47.953120,0 days 00:01:32.972340,,8,,,15,,0.4379221113744403,,0.017680268482750918,,0.920774406930748,SGD,3.0,fine_tuning,ReduceLROnPlateau,,1.3766533789083794e-05,PRUNED
84,84,0.7597053647041321,2025-01-27 02:54:47.969371,2025-01-27 03:01:40.404102,0 days 00:06:52.434731,,8,,,19,,,0.31198633390415953,0.006094664623816693,,0.9399822697416765,SGD,,fine_tuning,StepLR,3.0,0.00017372581515603,COMPLETE
85,85,0.7490311861038208,2025-01-27 03:01:40.430367,2025-01-27 03:09:05.073818,0 days 00:07:24.643451,,4,,,20,,,0.21539992333260427,0.006164314363129574,,0.9539491183899069,SGD,,fine_tuning,StepLR,3.0,3.1144079635226655e-05,COMPLETE
86,86,0.0,2025-01-27 03:09:05.100568,2025-01-27 03:10:36.458803,0 days 00:01:31.358235,,8,,,19,,,0.32115181037259577,0.0010239943826240456,,0.9324454569908056,RMSprop,,fine_tuning,StepLR,2.0,0.121862451106731,PRUNED
87,87,0.0,2025-01-27 03:10:36.475160,2025-01-27 03:12:09.469051,0 days 00:01:32.993891,,8,,,20,,,0.4345012465642726,0.010810103398242824,,0.9472818319016121,SGD,,fine_tuning,StepLR,3.0,0.0001288108676576504,PRUNED
