,number,value,datetime_start,datetime_complete,duration,params_T_max,params_batch_size,params_beta1,params_beta2,params_epochs,params_eta_min,params_factor,params_gamma,params_lr,params_max_lr,params_momentum,params_optimizer,params_patience,params_preweight_mode,params_scheduler,params_step_size,params_weight_decay,state
90,90,0.36371609568595886,2025-01-28 02:59:39.887512,2025-01-28 03:02:57.170243,0 days 00:03:17.282731,,6,0.8506383262316448,0.9145419612394502,19,,,0.4044647760146308,0.001887075723449868,,,Adam,,fine_tuning,StepLR,2.0,,PRUNED
91,91,0.7670245170593262,2025-01-28 03:02:57.187698,2025-01-28 03:13:50.555113,0 days 00:10:53.367415,,6,,,20,,,0.3745749242834134,0.010125784867475389,,0.900147471808927,SGD,,fine_tuning,StepLR,2.0,1.5453480800180298e-05,COMPLETE
92,92,0.7630857229232788,2025-01-28 03:13:50.581168,2025-01-28 03:24:43.207525,0 days 00:10:52.626357,,6,,,20,,,0.3760337167448029,0.010628367245415755,,0.9004321768278143,SGD,,fine_tuning,StepLR,2.0,2.3181334830656762e-05,COMPLETE
93,93,0.7702442407608032,2025-01-28 03:24:43.233879,2025-01-28 03:35:37.197643,0 days 00:10:53.963764,,6,,,20,,,0.37607657280209517,0.00979177230942651,,0.9012903099003384,SGD,,fine_tuning,StepLR,2.0,1.5518657034657813e-05,COMPLETE
94,94,0.7624230980873108,2025-01-28 03:35:37.224179,2025-01-28 03:46:30.620163,0 days 00:10:53.395984,,6,,,20,,,0.3355690214098628,0.009850136334529112,,0.9021701698110085,SGD,,fine_tuning,StepLR,2.0,1.5654831295339128e-05,COMPLETE
95,95,0.7328046560287476,2025-01-28 03:46:30.638044,2025-01-28 03:56:50.678078,0 days 00:10:20.040034,,6,,,19,,,0.3793660826290245,0.011127589054971913,,0.9003615200151618,SGD,,fine_tuning,StepLR,2.0,1.8755401763391818e-05,COMPLETE
96,96,0.7692176699638367,2025-01-28 03:56:50.708177,2025-01-28 04:07:43.859411,0 days 00:10:53.151234,,6,,,20,,,0.3210295531332782,0.01014436048386694,,0.9048588129675879,SGD,,fine_tuning,StepLR,2.0,1.1786060005974861e-05,COMPLETE
97,97,0.0,2025-01-28 04:07:43.885577,2025-01-28 04:09:08.675858,0 days 00:01:24.790281,,5,,,19,,,,0.009631220729179076,0.0032847677267418417,0.9061267728838512,SGD,,freezing,OneCycleLR,,1.2406292718315049e-05,PRUNED
98,98,0.7411350011825562,2025-01-28 04:09:08.692013,2025-01-28 04:19:28.085011,0 days 00:10:19.392998,,6,,,19,,,0.31047915957601785,0.010869840584306685,,0.9037253005737238,SGD,,fine_tuning,StepLR,2.0,1.2049733501694074e-05,COMPLETE
99,99,0.0,2025-01-28 04:19:28.111533,2025-01-28 04:22:00.274820,0 days 00:02:32.163287,,6,,,18,,,0.32474532147618546,0.008751596239386301,,0.9090240369062973,RMSprop,,fine_tuning,StepLR,3.0,0.10062116924507239,PRUNED
