,number,value,datetime_start,datetime_complete,duration,params_T_max,params_batch_size,params_beta1,params_beta2,params_epochs,params_eta_min,params_factor,params_gamma,params_lr,params_max_lr,params_momentum,params_optimizer,params_patience,params_preweight_mode,params_scheduler,params_step_size,params_weight_decay,state
0,0,0.6554962396621704,2025-01-27 18:32:06.318206,2025-01-27 18:41:51.708428,0 days 00:09:45.390222,8.0,7,0.9658118084445251,0.9318563294010559,17,8.307341815284441e-06,,,0.0009472961959721175,,,Adam,,fine_tuning,CosineAnnealingLR,,,COMPLETE
1,1,0.3915941119194031,2025-01-27 18:41:51.735844,2025-01-27 18:49:38.588896,0 days 00:07:46.853052,,6,0.9169765854389738,0.9282853454922604,13,,,0.16714116943161034,0.0004904539339172869,,,Adam,,random,StepLR,5.0,,COMPLETE
2,2,0.10405264794826508,2025-01-27 18:49:38.619130,2025-01-27 18:54:22.386999,0 days 00:04:43.767869,,8,,,17,,,0.17734318931932058,0.004241247429282568,,0.9492067843282642,RMSprop,,freezing,StepLR,5.0,0.1260926568334326,COMPLETE
3,3,0.19754835963249207,2025-01-27 18:54:22.414614,2025-01-27 18:58:02.493182,0 days 00:03:40.078568,,8,,,13,,,0.056083539958035666,0.04948808716982222,,0.9468789822431335,SGD,,freezing,StepLR,5.0,5.129973236412686e-05,COMPLETE
4,4,0.6518693566322327,2025-01-27 18:58:02.519872,2025-01-27 19:07:19.430290,0 days 00:09:16.910418,,6,,,17,,,,0.02344308086614435,0.004548729885792942,0.9727457317944981,SGD,,fine_tuning,OneCycleLR,,4.760099310748672e-05,COMPLETE
5,5,0.0,2025-01-27 19:07:19.460372,2025-01-27 19:10:04.992415,0 days 00:02:45.532043,,7,,,17,,0.2973243346544745,,0.0012548593198908888,,0.9780810792026231,RMSprop,3.0,fine_tuning,ReduceLROnPlateau,,0.5380377852807633,PRUNED
6,6,0.7760161757469177,2025-01-27 19:10:05.012079,2025-01-27 19:18:50.153373,0 days 00:08:45.141294,5.0,7,,,16,4.0935047202991817e-07,,,0.016998759580392438,,0.9201578015051693,SGD,,fine_tuning,CosineAnnealingLR,,1.0003658748852571e-05,COMPLETE
7,7,0.0028753404039889574,2025-01-27 19:18:50.180015,2025-01-27 19:20:31.440416,0 days 00:01:41.260401,,6,,,17,,0.29754314502094625,,0.0035675054331891385,,0.9775188644231251,RMSprop,2.0,freezing,ReduceLROnPlateau,,0.10566344366433493,PRUNED
8,8,0.0,2025-01-27 19:20:31.457122,2025-01-27 19:23:30.314336,0 days 00:02:58.857214,,7,,,14,,0.13439332022060319,,0.0010523472087119428,,0.902710004059513,RMSprop,4.0,random,ReduceLROnPlateau,,0.11239553251294436,PRUNED
9,9,0.1659097671508789,2025-01-27 19:23:30.332061,2025-01-27 19:25:12.272887,0 days 00:01:41.940826,12.0,7,,,18,8.368075421103245e-07,,,0.04198573470793485,,0.9163819443057865,SGD,,freezing,CosineAnnealingLR,,3.626824917046231e-05,PRUNED
10,10,0.7268170714378357,2025-01-27 19:25:12.291255,2025-01-27 19:36:15.199658,0 days 00:11:02.908403,5.0,4,0.8384084637388263,0.9966465871541936,20,1.2726349105392805e-07,,,0.0001727935630014265,,,AdamW,,fine_tuning,CosineAnnealingLR,,0.001305443110763528,COMPLETE
11,11,0.722079336643219,2025-01-27 19:36:15.226372,2025-01-27 19:47:17.907399,0 days 00:11:02.681027,5.0,4,0.8132826859576652,0.9981630949532025,20,1.0373933550020707e-07,,,0.00011006134382628895,,,AdamW,,fine_tuning,CosineAnnealingLR,,0.001219332330568898,COMPLETE
12,12,0.7379414439201355,2025-01-27 19:47:17.937474,2025-01-27 19:52:49.499197,0 days 00:05:31.561723,5.0,4,0.8165133763101086,0.9988745754088791,10,1.3628971680225684e-07,,,0.0001785101188525541,,,AdamW,,fine_tuning,CosineAnnealingLR,,0.0012591873389691888,COMPLETE
13,13,0.6880541443824768,2025-01-27 19:52:49.525921,2025-01-27 19:58:20.374770,0 days 00:05:30.848849,8.0,5,0.8707471701688952,0.9639366052924087,10,4.4983760781013313e-07,,,0.0003921279387881188,,,AdamW,,fine_tuning,CosineAnnealingLR,,0.0011847836434812024,COMPLETE
14,14,0.0,2025-01-27 19:58:20.401651,2025-01-27 20:01:38.446106,0 days 00:03:18.044455,,5,,,10,,,,0.015169319217863849,0.00010254561856137388,0.9251752004622653,SGD,,fine_tuning,OneCycleLR,,1.1831466490054087e-05,PRUNED
15,15,0.7101292610168457,2025-01-27 20:01:38.465045,2025-01-27 20:08:15.995317,0 days 00:06:37.530272,15.0,5,0.8013666468512903,0.9647848203273699,12,3.536496048207866e-07,,,0.00027509254332917305,,,AdamW,,fine_tuning,CosineAnnealingLR,,0.0025655884291418333,COMPLETE
16,16,0.2045297920703888,2025-01-27 20:08:16.025835,2025-01-27 20:11:54.320976,0 days 00:03:38.295141,7.0,4,,,15,2.632918039882891e-07,,,0.013892198156415863,,0.9285446680004956,SGD,,random,CosineAnnealingLR,,0.00020360247188624996,PRUNED
17,17,0.1381349265575409,2025-01-27 20:11:54.339724,2025-01-27 20:15:12.947865,0 days 00:03:18.608141,11.0,5,0.9048626018885886,0.9082256257207966,11,3.289434935407201e-06,,,0.0024178983079523857,,,AdamW,,fine_tuning,CosineAnnealingLR,,0.002936350480191242,PRUNED
18,18,0.6328240633010864,2025-01-27 20:15:12.968126,2025-01-27 20:18:31.057481,0 days 00:03:18.089355,,7,0.9683613329569909,0.9730140088111502,15,,,,0.0005535746416412366,0.00028820919478023745,,Adam,,fine_tuning,OneCycleLR,,,PRUNED
19,19,0.039603959769010544,2025-01-27 20:18:31.076057,2025-01-27 20:22:04.781018,0 days 00:03:33.704961,5.0,8,0.8661956870897728,0.9795504094990028,15,1.5376199472548882e-06,,,0.00010294181735982667,,,AdamW,,random,CosineAnnealingLR,,0.004374896478117527,PRUNED
20,20,0.7721062898635864,2025-01-27 20:22:04.799265,2025-01-27 20:32:25.919972,0 days 00:10:21.120707,7.0,6,,,19,2.405352820634366e-07,,,0.00984858368139984,,0.9036154357682028,SGD,,fine_tuning,CosineAnnealingLR,,1.030219195696325e-05,COMPLETE
21,21,0.7414559125900269,2025-01-27 20:32:25.947273,2025-01-27 20:42:46.748621,0 days 00:10:20.801348,7.0,6,,,19,2.538395959476587e-07,,,0.01097758333880567,,0.9004695376397125,SGD,,fine_tuning,CosineAnnealingLR,,1.0334682674053017e-05,COMPLETE
22,22,0.7527187466621399,2025-01-27 20:42:46.775503,2025-01-27 20:53:07.980220,0 days 00:10:21.204717,7.0,6,,,19,2.669137339202579e-07,,,0.011301587205138203,,0.9019022228838534,SGD,,fine_tuning,CosineAnnealingLR,,1.065292755106599e-05,COMPLETE
23,23,0.738433837890625,2025-01-27 20:53:08.007003,2025-01-27 21:03:28.157055,0 days 00:10:20.150052,9.0,6,,,19,6.32293036502911e-07,,,0.010594174875782434,,0.913554417163203,SGD,,fine_tuning,CosineAnnealingLR,,1.948725550303225e-05,COMPLETE
24,24,0.711764931678772,2025-01-27 21:03:28.183651,2025-01-27 21:13:49.334482,0 days 00:10:21.150831,7.0,6,,,19,2.14323188833096e-07,,,0.020968716832700317,,0.912654689750742,SGD,,fine_tuning,CosineAnnealingLR,,1.9240381395930702e-05,COMPLETE
25,25,0.7497597932815552,2025-01-27 21:13:49.362852,2025-01-27 21:23:39.130177,0 days 00:09:49.767325,6.0,7,,,18,1.3528111753629974e-06,,,0.010447640281174097,,0.9290940644547548,SGD,,fine_tuning,CosineAnnealingLR,,1.7489352805612285e-05,COMPLETE
26,26,0.788288950920105,2025-01-27 21:23:39.156996,2025-01-27 21:32:22.104221,0 days 00:08:42.947225,,6,,,16,,,0.4675919867692174,0.018664255816950658,,0.9012538185195407,SGD,,fine_tuning,StepLR,2.0,3.08141794416894e-05,COMPLETE
27,27,0.7964865565299988,2025-01-27 21:32:22.132122,2025-01-27 21:41:08.918248,0 days 00:08:46.786126,,5,,,16,,,0.4872096123249667,0.02003307641178482,,0.9149985660582497,SGD,,fine_tuning,StepLR,2.0,2.907225663621022e-05,COMPLETE
28,28,0.15224120020866394,2025-01-27 21:41:08.945177,2025-01-27 21:42:52.361955,0 days 00:01:43.416778,,5,,,16,,,0.4897908657970608,0.02143058649883532,,0.9382350336873255,SGD,,freezing,StepLR,2.0,3.064403606104241e-05,PRUNED
29,29,0.0,2025-01-27 21:42:52.377470,2025-01-27 21:45:52.083989,0 days 00:02:59.706519,,5,0.9966872395146547,0.9013393876065032,16,,,0.497195674751372,0.004406688563154684,,,Adam,,random,StepLR,2.0,,PRUNED
30,30,0.6710301041603088,2025-01-27 21:45:52.104412,2025-01-27 21:49:09.197046,0 days 00:03:17.092634,,7,,,16,,,0.3730836841906143,0.027541719917962258,,0.919560756549253,SGD,,fine_tuning,StepLR,3.0,0.0001326279756401553,PRUNED
31,31,0.7396700978279114,2025-01-27 21:49:09.214856,2025-01-27 21:56:47.460258,0 days 00:07:38.245402,,6,,,14,,,0.3598401409012907,0.016933962038117503,,0.9075377587309724,SGD,,fine_tuning,StepLR,3.0,1.5689571341241856e-05,COMPLETE
32,32,0.7517696619033813,2025-01-27 21:56:47.487966,2025-01-27 22:06:34.560443,0 days 00:09:47.072477,,6,,,18,,,0.3877575365113006,0.01783275646368505,,0.909025110099998,SGD,,fine_tuning,StepLR,2.0,2.6499240133021447e-05,COMPLETE
33,33,0.0,2025-01-27 22:06:34.582900,2025-01-27 22:09:19.690724,0 days 00:02:45.107824,,5,0.9318263139519829,0.9499893676369983,16,,,0.43928298856392667,0.006682768761582391,,,Adam,,fine_tuning,StepLR,3.0,,PRUNED
34,34,0.7525782585144043,2025-01-27 22:09:19.709415,2025-01-27 22:16:53.348122,0 days 00:07:33.638707,,8,,,14,,,0.2917773039825793,0.028588524267748293,,0.9210420862026929,SGD,,fine_tuning,StepLR,2.0,7.123254686038534e-05,COMPLETE
35,35,0.7579300999641418,2025-01-27 22:16:53.375459,2025-01-27 22:23:58.460359,0 days 00:07:05.084900,,6,,,13,,,0.4369502220060438,0.012922612905989514,,0.9357573499989195,SGD,,fine_tuning,StepLR,4.0,2.4468239729144403e-05,COMPLETE
36,36,0.062319763004779816,2025-01-27 22:23:58.487682,2025-01-27 22:25:39.238997,0 days 00:01:40.751315,,8,,,16,,,,0.019331690517439794,0.009455926511160086,0.9074984988621543,SGD,,freezing,OneCycleLR,,1.4764200121039065e-05,PRUNED
37,37,0.0,2025-01-27 22:25:39.255765,2025-01-27 22:28:13.194245,0 days 00:02:33.938480,,7,,,17,,0.49457515996863854,,0.007714510997511258,,0.9124830012425091,RMSprop,5.0,random,ReduceLROnPlateau,,0.16271129510137022,PRUNED
38,38,0.7084672451019287,2025-01-27 22:28:13.213921,2025-01-27 22:31:29.643301,0 days 00:03:16.429380,,6,,,18,,,0.3130040128673539,0.026048110086854852,,0.9536696347248155,SGD,,fine_tuning,StepLR,4.0,4.331807867911659e-05,PRUNED
39,39,0.17275263369083405,2025-01-27 22:31:29.661437,2025-01-27 22:33:11.436066,0 days 00:01:41.774629,,7,,,17,,0.47805538532066605,,0.015104328145582427,,0.9607774897994311,SGD,2.0,freezing,ReduceLROnPlateau,,7.425867986897201e-05,PRUNED
40,40,9.984192001866177e-05,2025-01-27 22:33:11.452628,2025-01-27 22:36:16.676597,0 days 00:03:05.223969,,5,,,14,,,0.44742627710499644,0.007806864634474945,,0.9214574566241911,RMSprop,,fine_tuning,StepLR,3.0,0.12875013784659248,PRUNED
41,41,0.6884390115737915,2025-01-27 22:36:16.698525,2025-01-27 22:39:33.492286,0 days 00:03:16.793761,,6,,,12,,,0.42188880143707996,0.01398836519328797,,0.9376597349923569,SGD,,fine_tuning,StepLR,4.0,2.3096247487531283e-05,PRUNED
42,42,0.7578500509262085,2025-01-27 22:39:33.507637,2025-01-27 22:46:06.313850,0 days 00:06:32.806213,,6,,,12,,,0.49015469487115115,0.012670472882487556,,0.9359780443351209,SGD,,fine_tuning,StepLR,4.0,1.4037945099450079e-05,COMPLETE
43,43,0.7923312783241272,2025-01-27 22:46:06.342714,2025-01-27 22:53:12.116499,0 days 00:07:05.773785,,7,,,13,,,0.43053652677023435,0.023905678468141928,,0.9063724338358228,SGD,,fine_tuning,StepLR,2.0,3.646001746846494e-05,COMPLETE
44,44,0.7598735690116882,2025-01-27 22:53:12.144000,2025-01-27 23:01:24.672997,0 days 00:08:12.528997,,7,,,15,,,0.35284574316880524,0.034880237296216095,,0.9060696366019355,SGD,,fine_tuning,StepLR,2.0,5.5218681162293724e-05,COMPLETE
45,45,0.0012376237427815795,2025-01-27 23:01:24.699323,2025-01-27 23:04:39.637120,0 days 00:03:14.937797,,8,0.8698915700792923,0.9211814427676809,13,,,0.23665335380273256,0.005828379654001823,,,Adam,,fine_tuning,StepLR,2.0,,PRUNED
46,46,0.0,2025-01-27 23:04:39.652463,2025-01-27 23:07:23.738655,0 days 00:02:44.086192,,7,,,17,,,,0.024617666951146974,0.0012588023741918468,0.9009980978838085,SGD,,fine_tuning,OneCycleLR,,3.641462111230379e-05,PRUNED
47,47,0.15516260266304016,2025-01-27 23:07:23.753616,2025-01-27 23:09:05.051243,0 days 00:01:41.297627,,7,,,15,,0.10028206846671645,,0.031189256812922707,,0.9106113312840267,SGD,5.0,freezing,ReduceLROnPlateau,,3.219732540550219e-05,PRUNED
48,48,0.0,2025-01-27 23:09:05.068798,2025-01-27 23:11:39.927627,0 days 00:02:34.858829,,6,,,13,,,0.41173673049823134,0.008740686008783822,,0.9154959039792732,RMSprop,,fine_tuning,StepLR,2.0,0.10189219756630423,PRUNED
49,49,0.1831158697605133,2025-01-27 23:11:39.945688,2025-01-27 23:15:17.679854,0 days 00:03:37.734166,10.0,4,,,20,6.281804794577253e-07,,,0.021720358985664955,,0.9057557939935543,SGD,,random,CosineAnnealingLR,,1.3322779613468564e-05,PRUNED
50,50,0.6860411167144775,2025-01-27 23:15:17.697165,2025-01-27 23:18:35.342791,0 days 00:03:17.645626,,7,,,11,,,0.4826644514740718,0.018706802184843163,,0.9884359623570766,SGD,,fine_tuning,StepLR,3.0,5.6428547506449855e-05,PRUNED
51,51,0.7403773069381714,2025-01-27 23:18:35.360732,2025-01-27 23:26:46.972601,0 days 00:08:11.611869,,7,,,15,,,0.3467082299962326,0.0351052820961923,,0.9051217668389787,SGD,,fine_tuning,StepLR,2.0,5.3752022232456656e-05,COMPLETE
52,52,0.7298666834831238,2025-01-27 23:26:47.002690,2025-01-27 23:35:29.176431,0 days 00:08:42.173741,,7,,,16,,,0.4469533852563592,0.047590227812583374,,0.9000486448760923,SGD,,fine_tuning,StepLR,2.0,0.00010207377567156594,COMPLETE
53,53,0.7550838589668274,2025-01-27 23:35:29.195001,2025-01-27 23:43:41.460948,0 days 00:08:12.265947,,7,,,15,,,0.33796061067664496,0.03931437660305751,,0.9174905697176008,SGD,,fine_tuning,StepLR,2.0,4.147825645460338e-05,COMPLETE
54,54,0.019801979884505272,2025-01-27 23:43:41.487418,2025-01-27 23:46:56.253021,0 days 00:03:14.765603,,8,,,14,,,,0.015994150710247488,0.0013482617435601836,0.9079044474552607,SGD,,fine_tuning,OneCycleLR,,2.1499235905985154e-05,PRUNED
55,55,0.6711206436157227,2025-01-27 23:46:56.270836,2025-01-27 23:50:13.859244,0 days 00:03:17.588408,13.0,7,,,17,1.7188021930768358e-06,,,0.0238650810895907,,0.9053580322566097,SGD,,fine_tuning,CosineAnnealingLR,,6.508666043070644e-05,PRUNED
56,56,0.7275798916816711,2025-01-27 23:50:13.874635,2025-01-28 00:00:05.585508,0 days 00:09:51.710873,,5,,,18,,,0.39122868302415154,0.032451915623164455,,0.9256503521799364,SGD,,fine_tuning,StepLR,2.0,2.799759381174112e-05,COMPLETE
57,57,0.0,2025-01-28 00:00:05.612378,2025-01-28 00:02:49.589951,0 days 00:02:43.977573,9.0,6,0.9432335219055896,0.9450780663135097,14,3.0317446207576263e-06,,,0.008257710315967014,,,AdamW,,fine_tuning,CosineAnnealingLR,,0.0014290449311488522,PRUNED
58,58,0.0,2025-01-28 00:02:49.608184,2025-01-28 00:05:34.065145,0 days 00:02:44.456961,,7,0.9942149899320953,0.9485202888303361,17,,0.37879177206173575,,0.00597344745308052,,,Adam,3.0,fine_tuning,ReduceLROnPlateau,,,PRUNED
59,59,0.0,2025-01-28 00:05:34.084114,2025-01-28 00:08:33.782120,0 days 00:02:59.698006,6.0,6,,,16,4.357772749989558e-07,,,0.0197804584769484,,0.911116124597663,SGD,,random,CosineAnnealingLR,,0.00010316274581128549,PRUNED
60,60,0.0,2025-01-28 00:08:33.801124,2025-01-28 00:11:42.467407,0 days 00:03:08.666283,,5,,,15,,,0.45776430068102186,0.009080331550839977,,0.9043082519982001,RMSprop,,fine_tuning,StepLR,3.0,0.10145690358437118,PRUNED
61,61,0.7336482405662537,2025-01-28 00:11:42.485918,2025-01-28 00:18:47.676423,0 days 00:07:05.190505,,6,,,13,,,0.41699487460068313,0.01688974278907789,,0.932935451813428,SGD,,fine_tuning,StepLR,4.0,2.6212078003585107e-05,COMPLETE
62,62,0.7617182731628418,2025-01-28 00:18:47.705070,2025-01-28 00:25:21.129622,0 days 00:06:33.424552,,6,,,12,,,0.4690849277628455,0.012201220417945418,,0.9148311250624278,SGD,,fine_tuning,StepLR,2.0,3.6427748563530256e-05,COMPLETE
63,63,0.7489196062088013,2025-01-28 00:25:21.155986,2025-01-28 00:31:20.848207,0 days 00:05:59.692221,,6,,,11,,,0.46733587989623615,0.011902829242276336,,0.9157824532124679,SGD,,fine_tuning,StepLR,2.0,3.643978667598571e-05,COMPLETE
64,64,0.7426344752311707,2025-01-28 00:31:20.878474,2025-01-28 00:37:52.439077,0 days 00:06:31.560603,,6,,,12,,,0.39740686386729734,0.009907664218544039,,0.92337020626916,SGD,,fine_tuning,StepLR,2.0,4.5461253997989956e-05,COMPLETE
65,65,0.7594127058982849,2025-01-28 00:37:52.465936,2025-01-28 00:43:53.403741,0 days 00:06:00.937805,9.0,7,,,11,1.7436725816243892e-07,,,0.022290351090538455,,0.9132531388431001,SGD,,fine_tuning,CosineAnnealingLR,,1.0649794294033208e-05,COMPLETE
66,66,0.1651587337255478,2025-01-28 00:43:53.430198,2025-01-28 00:45:36.367684,0 days 00:01:42.937486,,5,,,13,,,0.46590298531478147,0.01500457837718908,,0.9035054138597779,SGD,,freezing,StepLR,2.0,1.7106010401705873e-05,PRUNED
67,67,0.0,2025-01-28 00:45:36.383200,2025-01-28 00:48:20.928367,0 days 00:02:44.545167,,7,0.8393298094551278,0.920542920682934,16,,,0.25263850316466807,0.007136232022533874,,,AdamW,,fine_tuning,StepLR,2.0,0.001126548879714874,PRUNED
68,68,0.7356660962104797,2025-01-28 00:48:20.946960,2025-01-28 00:56:31.247806,0 days 00:08:10.300846,6.0,6,,,15,9.483670368639188e-07,,,0.020372939637778177,,0.9083616023149579,SGD,,fine_tuning,CosineAnnealingLR,,2.068618408592598e-05,COMPLETE
69,69,0.0,2025-01-28 00:56:31.274608,2025-01-28 00:59:13.257505,0 days 00:02:41.982897,,8,,,12,,,,0.013852167020531422,0.00031843574419035696,0.9164714677116139,SGD,,fine_tuning,OneCycleLR,,8.786950216781653e-05,PRUNED
70,70,0.7351829409599304,2025-01-28 00:59:13.272495,2025-01-28 01:06:53.903118,0 days 00:07:40.630623,,4,,,14,,,0.4678698639480466,0.017534975730790416,,0.9106483822246237,SGD,,fine_tuning,StepLR,2.0,1.2865389506976585e-05,COMPLETE
71,71,0.7361871004104614,2025-01-28 01:06:53.936277,2025-01-28 01:12:54.666193,0 days 00:06:00.729916,9.0,7,,,11,1.791457574569772e-07,,,0.018537904067625875,,0.9133427940645203,SGD,,fine_tuning,CosineAnnealingLR,,1.1117482382208333e-05,COMPLETE
72,72,0.7228343486785889,2025-01-28 01:12:54.694776,2025-01-28 01:18:23.908097,0 days 00:05:29.213321,8.0,7,,,10,1.6879628248693858e-07,,,0.022410265106018172,,0.9178762645300562,SGD,,fine_tuning,CosineAnnealingLR,,1.0794287841841047e-05,COMPLETE
73,73,0.7209827303886414,2025-01-28 01:18:23.939066,2025-01-28 01:24:25.787176,0 days 00:06:01.848110,10.0,7,,,11,4.185772093681891e-07,,,0.02919047954074714,,0.9025125763809143,SGD,,fine_tuning,CosineAnnealingLR,,3.093036401627552e-05,COMPLETE
74,74,0.7318183779716492,2025-01-28 01:24:25.813569,2025-01-28 01:30:26.876305,0 days 00:06:01.062736,11.0,7,,,11,3.483217431054997e-07,,,0.016061771803184174,,0.9129740845046779,SGD,,fine_tuning,CosineAnnealingLR,,1.6653225317862412e-05,COMPLETE
75,75,0.0,2025-01-28 01:30:26.903776,2025-01-28 01:33:10.374599,0 days 00:02:43.470823,6.0,6,0.9616689990857051,0.982789816593925,20,6.218770197188043e-07,,,0.009246871502787024,,,Adam,,fine_tuning,CosineAnnealingLR,,,PRUNED
76,76,0.0,2025-01-28 01:33:10.393131,2025-01-28 01:36:10.129469,0 days 00:02:59.736338,,7,,,10,,,0.09509322913521975,0.026363642314146587,,0.9202433827029799,SGD,,random,StepLR,3.0,1.245358454385865e-05,PRUNED
77,77,0.691192626953125,2025-01-28 01:36:10.149153,2025-01-28 01:39:27.318754,0 days 00:03:17.169601,8.0,6,,,12,1.7734843682355002e-07,,,0.022827779557928793,,0.9454425390194847,SGD,,fine_tuning,CosineAnnealingLR,,1.0140748873519118e-05,PRUNED
78,78,0.15927647054195404,2025-01-28 01:39:27.336384,2025-01-28 01:41:08.458670,0 days 00:01:41.122286,,7,,,19,,,0.42453394467597017,0.025028746877360723,,0.9275241267918424,SGD,,freezing,StepLR,2.0,6.098187547563204e-05,PRUNED
79,79,0.7301656603813171,2025-01-28 01:41:08.473433,2025-01-28 01:50:17.602301,0 days 00:09:09.128868,,8,,,17,,0.22078044400661923,,0.011983826427257028,,0.9073907764798351,SGD,4.0,fine_tuning,ReduceLROnPlateau,,3.9942141150496664e-05,COMPLETE
80,80,0.0,2025-01-28 01:50:17.628758,2025-01-28 01:52:47.631339,0 days 00:02:30.002581,8.0,6,,,16,8.335742167551972e-06,,,0.00928404861141382,,0.9101948087070278,RMSprop,,fine_tuning,CosineAnnealingLR,,0.10109996366642271,PRUNED
81,81,0.7354856133460999,2025-01-28 01:52:47.648872,2025-01-28 01:59:54.698847,0 days 00:07:07.049975,,6,,,13,,,0.4394310427115887,0.012584398158115954,,0.9656596053317726,SGD,,fine_tuning,StepLR,5.0,2.541188170478707e-05,COMPLETE
82,82,0.7292193174362183,2025-01-28 01:59:54.717466,2025-01-28 02:06:28.001126,0 days 00:06:33.283660,,6,,,12,,,0.49639138687112205,0.013549693473887294,,0.9142509105709211,SGD,,fine_tuning,StepLR,4.0,3.294315697152985e-05,COMPLETE
83,83,0.7370750308036804,2025-01-28 02:06:28.028104,2025-01-28 02:13:35.301195,0 days 00:07:07.273091,,5,,,13,,,0.46004467417276873,0.01471023176920081,,0.9035121815157955,SGD,,fine_tuning,StepLR,2.0,5.115135460190472e-05,COMPLETE
84,84,0.7759801149368286,2025-01-28 02:13:35.332030,2025-01-28 02:23:23.608786,0 days 00:09:48.276756,,6,,,18,,,0.3708940761871954,0.011103611398889698,,0.9407203441495795,SGD,,fine_tuning,StepLR,2.0,2.3975176575722844e-05,COMPLETE
85,85,0.7409150004386902,2025-01-28 02:23:23.639225,2025-01-28 02:33:14.304376,0 days 00:09:50.665151,,7,,,18,,,0.3144189153428495,0.011421565439067806,,0.9551968611569696,SGD,,fine_tuning,StepLR,2.0,1.8839127676436525e-05,COMPLETE
86,86,0.0,2025-01-28 02:33:14.335408,2025-01-28 02:35:58.420819,0 days 00:02:44.085411,,6,0.8876279757743334,0.9378583169641903,17,,,0.3682894883019316,0.008321424468115146,,,AdamW,,fine_tuning,StepLR,2.0,0.001049281941822832,PRUNED
87,87,0.7721663117408752,2025-01-28 02:35:58.438123,2025-01-28 02:46:19.026926,0 days 00:10:20.588803,,6,,,19,,,0.38328931458503657,0.010638011682348483,,0.9000412148556854,SGD,,fine_tuning,StepLR,2.0,1.4966005200829852e-05,COMPLETE
88,88,0.7733603119850159,2025-01-28 02:46:19.054690,2025-01-28 02:56:40.158355,0 days 00:10:21.103665,,6,,,19,,,0.39218653158198813,0.01037982332980774,,0.9004576405943691,SGD,,fine_tuning,StepLR,2.0,1.4773264961593248e-05,COMPLETE
89,89,0.0,2025-01-28 02:56:40.184642,2025-01-28 02:59:39.868200,0 days 00:02:59.683558,,6,,,19,,,0.3971631177300933,0.010315467771055365,,0.9426981580074901,SGD,,random,StepLR,2.0,1.4266284408492968e-05,PRUNED
